channel,url,title,date
VK:Archief,http://www.volkskrant.nl/wetenschap/belgische-specialisten-willen-nieuw-betalingssysteem~a4459280/,Belgische specialisten willen nieuw betalingssysteem,"Wed, 08 Feb 2017 01:00:00 GMT"
VK:Archief,http://www.volkskrant.nl/opinie/-oorlogstaal-aanhangers-coalitiepartijen-baart-zorgen~a4459184/,'Oorlogstaal' aanhangers coalitiepartijen baart zorgen,"Wed, 08 Feb 2017 01:00:00 GMT"
VK:Archief,http://www.volkskrant.nl/boeken/balzaal-vol-ontklede-echtgenotes~a4459174/,Balzaal vol ontklede echtgenotes,"Wed, 08 Feb 2017 01:00:00 GMT"
VK:Archief,http://www.volkskrant.nl/binnenland/scholen-zien-vrijheid-van-onderwijs-in-gevaar-komen-door-nieuwe-eis-overheid~a4459299/,Scholen zien vrijheid van onderwijs in gevaar komen door nieuwe eis overheid,"Tue, 07 Feb 2017 21:28:00 GMT"
VK:Archief,http://www.volkskrant.nl/archief/kiezersregistratie-vs-is-zo-lek-als-een-mandje-miljoenen-kiezers-stemmen-twee-keer~a4458819/,Kiezersregistratie VS is zo lek als een mandje: miljoenen kiezers stemmen twee keer,"Mon, 06 Feb 2017 22:15:00 GMT"
VK:Archief,http://www.volkskrant.nl/buitenland/bert-wagendorp-hoe-lang-kun-je-je-blijven-opwinden-over-trump~a4458346/,Bert Wagendorp: hoe lang kun je je blijven opwinden over Trump?,"Mon, 06 Feb 2017 07:00:00 GMT"
VK:Archief,http://www.volkskrant.nl/archief/de-teloorgang-van-de-school-voor-bijzonder-onderwijs~a4456060/,De teloorgang van de school voor bijzonder onderwijs,"Wed, 01 Feb 2017 01:00:00 GMT"
VK:Archief,http://www.volkskrant.nl/archief/-salade-van-yacon-en-witlof-met-een-pannenkoekje~a4455096/,Salade van yacon en witlof met een pannenkoekje,"Mon, 30 Jan 2017 01:00:00 GMT"
VK:Archief,http://www.volkskrant.nl/economie/volhardende-allesclaimer-met-gevoel-voor-affaires~a4453971/,Volhardende allesclaimer met gevoel voor affaires,"Thu, 26 Jan 2017 20:23:00 GMT"
VK:Archief,http://www.volkskrant.nl/binnenland/zware-duitse-bommen-weer-even-dagelijkse-kost~a4452896/,Zware Duitse bommen weer even dagelijkse kost,"Wed, 25 Jan 2017 01:00:00 GMT"
VK:Archief,http://www.volkskrant.nl/wetenschap/artsen-politici-maak-keuze-over-verdeling-zorgbudget~a4451375/,Artsen: politici maak keuze over verdeling zorgbudget,"Sat, 21 Jan 2017 01:00:00 GMT"
VK:Archief,http://www.volkskrant.nl/magazine/alles-vastleggen-om-het-verhaal-te-vertellen~a4451244/,Alles vastleggen om het verhaal te vertellen,"Sat, 21 Jan 2017 01:00:00 GMT"
VK:Archief,http://www.volkskrant.nl/archief/allerellendigst-uitgeput-onder-een-brandend-hete-zon~a4450655/,"Allerellendigst uitgeput, onder een brandend hete zon","Fri, 20 Jan 2017 01:00:00 GMT"
VK:Archief,http://www.volkskrant.nl/magazine/elektrotechneut-op-de-bres-voor-gehandicapten~a4449612/,Elektrotechneut op de bres voor gehandicapten,"Wed, 18 Jan 2017 01:00:00 GMT"
VK:Archief,http://www.volkskrant.nl/opinie/hoed-u-voor-de-boze-toiletmeneer-van-de-konditorei~a4449148/,Hoed u voor de boze toiletmeneer van de Konditorei,"Tue, 17 Jan 2017 01:00:00 GMT"
VK:Archief,http://www.volkskrant.nl/archief/voel-de-jesse~a4448729/,Voel de Jesse,"Mon, 16 Jan 2017 01:00:00 GMT"
VK:Archief,http://www.volkskrant.nl/televisie/de-volkskrant-tv-selectie-voor-zondag-15-januari~a4447829/,De Volkskrant tv-selectie voor zondag 15 januari,"Sun, 15 Jan 2017 01:00:00 GMT"
VK:Archief,http://www.volkskrant.nl/wetenschap/tattoopoli-gaat-pijnlijke-tatoeages-verwijderen~a4447574/,Tattoopoli gaat pijnlijke tatoeages verwijderen,"Fri, 13 Jan 2017 05:04:00 GMT"
VK:Archief,http://www.volkskrant.nl/beeldende-kunst/flaming-june-het-meisje-van-je-dromen~a4447457/,Flaming June: het meisje van je dromen,"Thu, 12 Jan 2017 18:30:00 GMT"
VK:Archief,http://www.volkskrant.nl/buitenland/geboortedorp-ban-ki-moon-ziet-hem-al-als-president~a4446994/,Geboortedorp Ban Ki-moon ziet hem al als president,"Thu, 12 Jan 2017 01:00:00 GMT"
VK:Archief,http://www.volkskrant.nl/binnenland/kringloopwinkel-is-de-dorpspomp-van-vught~a4447011/,Kringloopwinkel is de dorpspomp van Vught,"Thu, 12 Jan 2017 01:00:00 GMT"
VK:Archief,http://www.volkskrant.nl/muziek/platenbaas-seymour-stein-een-oor-voor-goede-liedjes~a4446914/,"Platenbaas Seymour Stein, een oor voor goede liedjes","Thu, 12 Jan 2017 01:00:00 GMT"
VK:Archief,http://www.volkskrant.nl/binnenland/met-afstand-de-populairste-jongen-van-groep-6~a4446922/,Met afstand de populairste jongen van groep 6,"Wed, 11 Jan 2017 18:30:00 GMT"
VK:Archief,http://www.volkskrant.nl/boeken/een-openbare-executie-in-rome~a4446402/,Een openbare executie in Rome,"Wed, 11 Jan 2017 01:00:00 GMT"
VK:Archief,http://www.volkskrant.nl/opinie/er-moet-een-kolkende-rivier-van-rancune-door-het-land-stromen~a4446502/,Er moet een kolkende rivier van rancune door het land stromen,"Wed, 11 Jan 2017 01:00:00 GMT"
VK:Archief,http://www.volkskrant.nl/opinie/gore-ratten-geloven-niet-in-negatief-effect-van-dehumaniserende-taal~a4446383/,Gore ratten geloven niet in negatief effect van dehumaniserende taal,"Wed, 11 Jan 2017 01:00:00 GMT"
VK:Archief,http://www.volkskrant.nl/binnenland/rotsblokken-zijn-voorlopig-oplossing-voor-stuw-grave~a4446489/,Rotsblokken zijn voorlopig oplossing voor stuw Grave,"Wed, 11 Jan 2017 01:00:00 GMT"
VK:Archief,http://www.volkskrant.nl/archief/dit-ambacht-is-een-zegen-maar-ook-een-vloek~a4446443/,Dit ambacht is een zegen maar ook een vloek,"Wed, 11 Jan 2017 01:00:00 GMT"
VK:Archief,http://www.volkskrant.nl/magazine/verzetsstrijder-en-vader-der-nederlandse-ex-militairen~a4446954/,Verzetsstrijder en vader der Nederlandse ex-militairen,"Wed, 11 Jan 2017 01:00:00 GMT"
VK:Archief,http://www.volkskrant.nl/wetenschap/heb-je-bij-vrouwelijke-arts-minder-kans-om-te-overlijden~a4445954/,Heb je bij vrouwelijke arts minder kans om te overlijden?,"Tue, 10 Jan 2017 01:00:00 GMT"
VK:Archief,http://www.volkskrant.nl/opinie/overgeleverd-aan-fascistoide-militairen~a4445520/,Overgeleverd aan fascistoïde militairen,"Mon, 09 Jan 2017 01:00:00 GMT"
VK:Archief,http://www.volkskrant.nl/opinie/voor-sommige-vogelaars-is-eenvoudig-geluk-niet-genoeg~a4443888/,Voor sommige vogelaars is eenvoudig geluk niet genoeg,"Thu, 05 Jan 2017 01:00:00 GMT"
VK:Archief,http://www.volkskrant.nl/sport/elfstedentochtuitzendingen-zijn-oefeningen-in-nostalgie~a4444028/,Elfstedentochtuitzendingen zijn oefeningen in nostalgie,"Thu, 05 Jan 2017 01:00:00 GMT"
VK:Archief,http://www.volkskrant.nl/magazine/een-lijstje-kennissen-om-te-bellen-en-uit-te-schelden~a4443873/,Een lijstje kennissen om te bellen en uit te schelden,"Thu, 05 Jan 2017 01:00:00 GMT"
VK:Archief,http://www.volkskrant.nl/magazine/trots-tevreden-en-vooral-reusachtig~a4443964/,"Trots, tevreden en vooral reusachtig","Thu, 05 Jan 2017 01:00:00 GMT"
VK:Archief,http://www.volkskrant.nl/binnenland/wie-kiest-wilders-voor-zijn-kandidatenlijst~a4444034/,Wie kiest Wilders voor zijn kandidatenlijst?,"Thu, 05 Jan 2017 01:00:00 GMT"
VK:Archief,http://www.volkskrant.nl/wetenschap/boeren-met-wat-hulp-van-boven~a4443925/,Boeren met wat hulp van boven,"Wed, 04 Jan 2017 18:34:00 GMT"
VK:Archief,http://www.volkskrant.nl/archief/vergeet-je-de-lieve-eekhoorn-niet~a4443443/,Vergeet je de lieve eekhoorn niet?,"Wed, 04 Jan 2017 01:00:00 GMT"
VK:Archief,http://www.volkskrant.nl/boeken/god-weet-hoe-het-de-broeders-in-polen-gaat~a4443397/,God weet hoe het de broeders in Polen gaat,"Wed, 04 Jan 2017 01:00:00 GMT"
VK:Archief,http://www.volkskrant.nl/economie/van-ac-restaurant-naar-la-place-zoek-de-verschillen~a4443065/,Van AC Restaurant naar La Place: zoek de verschillen,"Tue, 03 Jan 2017 01:00:00 GMT"
VK:Beeldende Kunst,http://www.volkskrant.nl/theater/geslaagde-jeugdtheatervoorstelling-over-oorlog~a4459212/,Geslaagde jeugdtheatervoorstelling over oorlog,"Wed, 08 Feb 2017 01:00:00 GMT"
VK:Beeldende Kunst,http://www.volkskrant.nl/beeldende-kunst/bedrijfscollecties-hebben-vaak-uitstekende-neus-voor-jong-talent~a4459242/,Bedrijfscollecties hebben vaak uitstekende neus voor jong talent,"Wed, 08 Feb 2017 01:00:00 GMT"
VK:Beeldende Kunst,http://www.volkskrant.nl/binnenland/kinderliedjes-of-pop-voor-samuel-is-muziek-adem~a4459186/,"Kinderliedjes of pop, voor Samuel is muziek adem","Tue, 07 Feb 2017 18:00:00 GMT"
VK:Beeldende Kunst,http://www.volkskrant.nl/muziek/zo-wil-het-residentieorkest-nieuw-jong-publiek-lokken~a4458717/,"Zo wil het Residentieorkest nieuw, jong publiek lokken","Tue, 07 Feb 2017 01:00:00 GMT"
VK:Beeldende Kunst,http://www.volkskrant.nl/beeldende-kunst/syrische-kunstenaar-maakt-busbarricade-in-dresden-als-eerbetoon-aan-aleppo~a4458741/,Syrische kunstenaar maakt busbarricade in Dresden als eerbetoon aan Aleppo,"Mon, 06 Feb 2017 18:00:00 GMT"
VK:Beeldende Kunst,http://www.volkskrant.nl/muziek/wereldpremiere-voor-nieuwe-compositie-van-rijnvos~a4458329/,Wereldpremière voor nieuwe compositie van Rijnvos,"Mon, 06 Feb 2017 06:08:00 GMT"
VK:Beeldende Kunst,http://www.volkskrant.nl/beeldende-kunst/meesterwerken-hangen-zij-aan-zij-met-hun-voorstudies~a4458288/,Meesterwerken hangen zij aan zij met hun voorstudies,"Mon, 06 Feb 2017 01:00:00 GMT"
VK:Beeldende Kunst,http://www.volkskrant.nl/recensies/jett-rebel-speelt-goed-maar-kan-publiek-niet-verleiden~a4458306/,"Jett Rebel speelt goed, maar kan publiek niet verleiden","Mon, 06 Feb 2017 01:00:00 GMT"
VK:Beeldende Kunst,http://www.volkskrant.nl/beeldende-kunst/manneken-pis-heeft-nu-zijn-eigen-museum-in-brussel~a4458266/,Manneken Pis heeft nu zijn eigen museum in Brussel,"Mon, 06 Feb 2017 01:00:00 GMT"
VK:Beeldende Kunst,http://www.volkskrant.nl/beeldende-kunst/waar-is-filmmaker-jacco-groen-52-nu-mee-bezig~a4458297/,Waar is filmmaker Jacco Groen (52) nu mee bezig?,"Mon, 06 Feb 2017 01:00:00 GMT"
VK:Beeldende Kunst,http://www.volkskrant.nl/theater/cadance-festival-laat-twee-nieuwelingen-excelleren~a4458322/,CaDance Festival laat twee nieuwelingen excelleren,"Sun, 05 Feb 2017 18:42:00 GMT"
VK:Beeldende Kunst,http://www.volkskrant.nl/beeldende-kunst/het-utopische-centre-pompidou-is-40-en-geliefder-dan-ooit~a4457835/,Het utopische Centre Pompidou is 40 en geliefder dan ooit,"Sat, 04 Feb 2017 01:00:00 GMT"
VK:Beeldende Kunst,http://www.volkskrant.nl/beeldende-kunst/rembrandt-schilderde-met-geweldige-overtuiging-een-struisvogelveer~a4457585/,Rembrandt schilderde met geweldige overtuiging een struisvogelveer,"Sat, 04 Feb 2017 01:00:00 GMT"
VK:Beeldende Kunst,http://www.volkskrant.nl/beeldende-kunst/-prozac-heeft-mijn-leven-gered~a4457836/,'Prozac heeft mijn leven gered',"Sat, 04 Feb 2017 01:00:00 GMT"
VK:Beeldende Kunst,http://www.volkskrant.nl/film/-ik-was-net-mijn-vader-obsessief-met-werk-bezig~a4457092/,'Ik was net mijn vader: obsessief met werk bezig',"Fri, 03 Feb 2017 01:00:00 GMT"
VK:Beeldende Kunst,http://www.volkskrant.nl/theater/van-wanorde-naar-orde-na-een-etmaal-in-het-theater~a4457109/,Van wanorde naar orde - na een etmaal in het theater,"Fri, 03 Feb 2017 01:00:00 GMT"
VK:Beeldende Kunst,http://www.volkskrant.nl/muziek/moet-een-piepend-oor-een-keuze-zijn~a4457177/,Moet een piepend oor een keuze zijn?,"Fri, 03 Feb 2017 01:00:00 GMT"
VK:Beeldende Kunst,http://www.volkskrant.nl/beeldende-kunst/leentjebuur-spelen-bij-rembrandt~a4457147/,Leentjebuur spelen bij Rembrandt,"Fri, 03 Feb 2017 01:00:00 GMT"
VK:Beeldende Kunst,http://www.volkskrant.nl/recensies/ed-van-der-elsken-verdient-zijn-ereplek~a4457100/,Ed van der Elsken verdient zijn ereplek,"Thu, 02 Feb 2017 17:47:00 GMT"
VK:Beeldende Kunst,http://www.volkskrant.nl/film/met-mensen-als-trump-is-de-bondboef-realiteit-geworden~a4456590/,Met mensen als Trump is de Bondboef realiteit geworden,"Thu, 02 Feb 2017 01:00:00 GMT"
VK:Beeldende Kunst,http://www.volkskrant.nl/theater/-italianen-horen-zichzelf-graag-praten~a4456566/,'Italianen horen zichzelf graag praten',"Thu, 02 Feb 2017 01:00:00 GMT"
VK:Beeldende Kunst,http://www.volkskrant.nl/recensies/toeval-bestaat-niet-in-tentoonstelling-martin-creed~a4456571/,Toeval bestaat niet in tentoonstelling Martin Creed,"Thu, 02 Feb 2017 01:00:00 GMT"
VK:Beeldende Kunst,http://www.volkskrant.nl/film/-wat-is-een-bijzonder-leven~a4456524/,'Wat is een bijzonder leven?',"Thu, 02 Feb 2017 01:00:00 GMT"
VK:Beeldende Kunst,http://www.volkskrant.nl/theater/alles-over-het-theaterjaar-2016-in-het-theaterjaarboek~a4456086/,Alles over het theaterjaar 2016 in het Theaterjaarboek,"Wed, 01 Feb 2017 01:00:00 GMT"
VK:Beeldende Kunst,http://www.volkskrant.nl/recensies/op-het-randje-van-de-koketterie~a4456083/,Op het randje van de koketterie,"Wed, 01 Feb 2017 01:00:00 GMT"
VK:Beeldende Kunst,http://www.volkskrant.nl/mode-en-mooi/amal-clooney-was-een-ideale-schildersmuze-geweest~a4456007/,Amal Clooney was een ideale schildersmuze geweest,"Wed, 01 Feb 2017 01:00:00 GMT"
VK:Beeldende Kunst,http://www.volkskrant.nl/beeldende-kunst/leuk-van-der-elsken-detail-ontdekt-muze-vali-meyers-had-echt-rood-haar~a4456000/,Leuk van der Elsken-detail ontdekt: muze Vali Meyers had écht rood haar,"Tue, 31 Jan 2017 16:27:00 GMT"
VK:Beeldende Kunst,http://www.volkskrant.nl/beeldende-kunst/stedelijk-museum-alkmaar-koopt-salomon-van-ruysdael-duurste-aankoop-in-bestaan~a4455570/,"Stedelijk Museum Alkmaar koopt Salomon van Ruysdael, duurste aankoop in bestaan","Tue, 31 Jan 2017 05:00:00 GMT"
VK:Beeldende Kunst,http://www.volkskrant.nl/mode-en-mooi/het-experiment-is-terug-bij-de-amsterdamse-modeweek~a4455552/,Het experiment is terug bij de Amsterdamse Modeweek,"Tue, 31 Jan 2017 01:00:00 GMT"
VK:Beeldende Kunst,http://www.volkskrant.nl/magazine/kreugers-beelden-zijn-figuratief-harmonisch-en-in-proportie~a4455619/,"Kreugers beelden zijn figuratief, harmonisch en in proportie","Tue, 31 Jan 2017 01:00:00 GMT"
VK:Beeldende Kunst,http://www.volkskrant.nl/boeken/-ik-doe-waar-ik-zin-in-heb-ik-leef-in-realtime~a4455104/,"'Ik doe waar ik zin in heb, ik leef in realtime'","Mon, 30 Jan 2017 01:00:00 GMT"
VK:Beeldende Kunst,http://www.volkskrant.nl/film/zombiefilms-als-luchtig-intermezzo-op-iffr~a4455121/,Zombiefilms als luchtig intermezzo op IFFR,"Mon, 30 Jan 2017 01:00:00 GMT"
VK:Beeldende Kunst,http://www.volkskrant.nl/film/-ik-voelde-een-rilling-door-mijn-lijf-gaan~a4454553/,'Ik voelde een rilling door mijn lijf gaan',"Sat, 28 Jan 2017 01:00:00 GMT"
VK:Beeldende Kunst,http://www.volkskrant.nl/beeldende-kunst/daar-komt-de-kikker-uit-de-mond~a4454389/,Daar komt de kikker uit de mond,"Sat, 28 Jan 2017 01:00:00 GMT"
VK:Beeldende Kunst,http://www.volkskrant.nl/magazine/-kunst-is-niet-alleen-iets-creeren-levenskunst-is-ook-belangrijk~a4453737/,'Kunst is niet alleen iets creëren. Levenskunst is ook belangrijk',"Sat, 28 Jan 2017 01:00:00 GMT"
VK:Beeldende Kunst,http://www.volkskrant.nl/beeldende-kunst/zeldzaam-is-het-hebbedingetje-dat-je-van-je-sokken-blaast~a4454321/,Zeldzaam is het hebbedingetje dat je van je sokken blaast,"Sat, 28 Jan 2017 01:00:00 GMT"
VK:Beeldende Kunst,http://www.volkskrant.nl/boeken/waardig-saluut-aan-ongrijpbare-rene-magritte~a4453871/,Waardig saluut aan ongrijpbare René Magritte,"Fri, 27 Jan 2017 01:02:00 GMT"
VK:Beeldende Kunst,http://www.volkskrant.nl/mode-en-mooi/stijlbroeders-met-een-doe-het-zelfmentaliteit~a4453955/,Stijlbroeders met een doe-het-zelfmentaliteit,"Fri, 27 Jan 2017 01:00:00 GMT"
VK:Beeldende Kunst,http://www.volkskrant.nl/beeldende-kunst/wetenschap-is-enorme-voorraadschuur-van-cultuur~a4453972/,Wetenschap is enorme voorraadschuur van cultuur,"Fri, 27 Jan 2017 01:00:00 GMT"
VK:Beeldende Kunst,http://www.volkskrant.nl/beeldende-kunst/mediakunst-als-middel-voor-kritiek~a4453918/,Mediakunst als middel voor kritiek,"Fri, 27 Jan 2017 01:00:00 GMT"
VK:Binnenland,http://www.volkskrant.nl/politiek/wie-kan-met-wie-regeren-bekijk-het-in-deze-coalitiewijzer~a4459611/,Wie kan met wie regeren? Bekijk het in deze coalitiewijzer,"Wed, 08 Feb 2017 10:02:00 GMT"
VK:Binnenland,http://www.volkskrant.nl/binnenland/verkiezingsblog-aow-leeftijd-breekpunt-voor-50plus-anders-niet-in-kabinet~a4449553/,Verkiezingsblog - AOW-leeftijd breekpunt voor 50Plus: 'Anders niet in kabinet',"Wed, 08 Feb 2017 09:28:00 GMT"
VK:Binnenland,http://www.volkskrant.nl/politiek/betaalt-tweede-werkende-ouder-65-procent-aan-belasting~a4458731/,Betaalt tweede werkende ouder 65 procent aan belasting?,"Wed, 08 Feb 2017 09:14:00 GMT"
VK:Binnenland,http://www.volkskrant.nl/binnenland/wat-nou-tulpen-en-kaas-deze-machines-leveren-holland-veel-meer-op~a4459338/,Wat nou tulpen en kaas: deze machines leveren Holland veel meer op,"Wed, 08 Feb 2017 05:00:00 GMT"
VK:Binnenland,http://www.volkskrant.nl/politiek/wie-houdt-er-toezicht-op-het-tappen-van-de-overheid~a4459246/,Wie houdt er toezicht op het tappen van de overheid?,"Wed, 08 Feb 2017 05:00:00 GMT"
VK:Binnenland,http://www.volkskrant.nl/politiek/groenlinks-gaat-verkiezing-in-met-ingrijpende-belastinghervorming~a4459521/,GroenLinks gaat verkiezing in met ingrijpende belastinghervorming,"Wed, 08 Feb 2017 05:00:00 GMT"
VK:Binnenland,http://www.volkskrant.nl/opinie/een-uitzonderlijk-fenomeen-een-basisschool-zeven-meesters-voor-de-klas~a4459275/,"Een uitzonderlijk fenomeen: één basisschool, zeven meesters voor de klas","Wed, 08 Feb 2017 01:00:00 GMT"
VK:Binnenland,http://www.volkskrant.nl/tech/sillicon-valley-technologie-start-ups-en-immigranten~a4459332/,"Sillicon Valley: technologie, start-ups en immigranten","Wed, 08 Feb 2017 01:00:00 GMT"
VK:Binnenland,http://www.volkskrant.nl/binnenland/blinde-afluisteraar-je-moet-kunnen-meeleven-met-doelwit~a4459248/,Blinde afluisteraar: 'Je moet kunnen meeleven met doelwit',"Wed, 08 Feb 2017 01:00:00 GMT"
VK:Binnenland,http://www.volkskrant.nl/economie/doorsneevermogen-stijgt-dankzij-huizenprijzen-voor-het-eerst-sinds-crisis~a4459298/,Doorsneevermogen stijgt dankzij huizenprijzen voor het eerst sinds crisis,"Wed, 08 Feb 2017 01:00:00 GMT"
VK:Binnenland,http://www.volkskrant.nl/binnenland/het-weer-vooral-koude-nachten~a4459169/,Het weer: vooral koude nachten,"Wed, 08 Feb 2017 01:00:00 GMT"
VK:Binnenland,http://www.volkskrant.nl/politiek/dit-vinden-de-zwevende-kiezers-van-de-stemwijzer~a4459266/,Dit vinden de zwevende kiezers van de Stemwijzer,"Wed, 08 Feb 2017 01:00:00 GMT"
VK:Binnenland,http://www.volkskrant.nl/politiek/nederlandse-lijsttrekkers-willen-graag-anti-trump-effect-van-macron-meemaken~a4459313/,Nederlandse lijsttrekkers willen graag anti-Trump effect van Macron meemaken,"Wed, 08 Feb 2017 01:00:00 GMT"
VK:Binnenland,http://www.volkskrant.nl/politiek/stemwijzers-bieden-hulp-in-tijden-van-keuzestress~a4459260/,Stemwijzers bieden hulp in tijden van keuzestress,"Wed, 08 Feb 2017 01:00:00 GMT"
VK:Binnenland,http://www.volkskrant.nl/politiek/na-de-stemwijzer-belandde-ik-in-een-crisis~a4459284/,Na de Stemwijzer belandde ik in een crisis,"Wed, 08 Feb 2017 01:00:00 GMT"
VK:Binnenland,http://www.volkskrant.nl/politiek/is-er-nog-mededogen~a4459167/,Is er nog mededogen?,"Wed, 08 Feb 2017 01:00:00 GMT"
VK:Binnenland,http://www.volkskrant.nl/opinie/wilders-doet-met-spelbederf-afbreuk-aan-de-democratie~a4459244/,Wilders doet met spelbederf afbreuk aan de democratie,"Wed, 08 Feb 2017 01:00:00 GMT"
VK:Binnenland,http://www.volkskrant.nl/economie/niet-iedereen-profiteert-van-het-economisch-herstel-in-nederland~a4459264/,Niet iedereen profiteert van het economisch herstel in Nederland,"Wed, 08 Feb 2017 01:00:00 GMT"
VK:Binnenland,http://www.volkskrant.nl/binnenland/scholen-zien-vrijheid-van-onderwijs-in-gevaar-komen-door-nieuwe-eis-overheid~a4459299/,Scholen zien vrijheid van onderwijs in gevaar komen door nieuwe eis overheid,"Tue, 07 Feb 2017 21:28:00 GMT"
VK:Binnenland,http://www.volkskrant.nl/politiek/denk-daagt-nrc-voor-de-rechter-vanwege-publicatie-uit-2016~a4459305/,Denk daagt NRC voor de rechter vanwege publicatie uit 2016,"Tue, 07 Feb 2017 21:27:00 GMT"
VK:Binnenland,http://www.volkskrant.nl/binnenland/duizenden-groningers-de-straat-op-tegen-gaswinning-kamp-is-een-ramp~a4459251/,Duizenden Groningers de straat op tegen gaswinning: 'Kamp is een ramp',"Tue, 07 Feb 2017 19:24:00 GMT"
VK:Binnenland,http://www.volkskrant.nl/binnenland/-over-onze-partij-wordt-vaak-gezegd-ze-doen-geen-vlieg-kwaad~a4459229/,"'Over onze partij wordt vaak gezegd, ze doen geen vlieg kwaad'","Tue, 07 Feb 2017 19:00:00 GMT"
VK:Binnenland,http://www.volkskrant.nl/politiek/het-binnenhof-7-februari~a4459110/,Het Binnenhof: 7 februari,"Tue, 07 Feb 2017 16:00:00 GMT"
VK:Binnenland,http://www.volkskrant.nl/binnenland/-niet-goed-nagedacht-over-beveiliging-stemwijzer~a4459026/,'Niet goed nagedacht over beveiliging Stemwijzer',"Tue, 07 Feb 2017 15:16:00 GMT"
VK:Binnenland,http://www.volkskrant.nl/binnenland/cultuurblog-regisseur-johan-simons-geselecteerd-voor-prestigieus-theaterfestival~a4446851/,Cultuurblog - Regisseur Johan Simons geselecteerd voor prestigieus theaterfestival,"Tue, 07 Feb 2017 15:15:00 GMT"
VK:Binnenland,http://www.volkskrant.nl/binnenland/nederland-kan-terugkerende-jihadist-bij-de-grens-weren-na-akkoord-eerste-kamer~a4459131/,Nederland kan terugkerende jihadist bij de grens weren na akkoord Eerste Kamer,"Tue, 07 Feb 2017 14:28:00 GMT"
VK:Binnenland,http://www.volkskrant.nl/binnenland/-valse-racismebeschuldiging-stagiaire-gerechtshof-ontaardt-in-welles-nietes-discussie~a4459122/,'Valse' racismebeschuldiging stagiaire Gerechtshof ontaardt in welles-nietes-discussie,"Tue, 07 Feb 2017 13:51:00 GMT"
VK:Binnenland,http://www.volkskrant.nl/politiek/ging-het-inkomen-van-rijksten-omhoog-en-de-rest-van-nederland-omlaag~a4457752/,Ging het inkomen van rijksten omhoog en de rest van Nederland omlaag?,"Tue, 07 Feb 2017 13:06:00 GMT"
VK:Binnenland,http://www.volkskrant.nl/binnenland/wie-is-pauline-krikke-de-nieuwe-burgemeester-van-den-haag~a4459114/,"Wie is Pauline Krikke, de nieuwe burgemeester van Den Haag?","Tue, 07 Feb 2017 13:00:00 GMT"
VK:Binnenland,http://www.volkskrant.nl/binnenland/hoge-raad-badr-hari-moet-gevangenisstraf-van-2-jaar-uitzitten~a4459027/,Hoge Raad: Badr Hari moet gevangenisstraf van 2 jaar uitzitten,"Tue, 07 Feb 2017 11:44:00 GMT"
VK:Binnenland,http://www.volkskrant.nl/binnenland/taxi-s-aanbieden-buiten-officiele-standplaats-bij-schiphol-wordt-vanaf-vandaag-fors-beboet~a4459087/,Taxi's aanbieden buiten officiële standplaats bij Schiphol wordt vanaf vandaag fors beboet,"Tue, 07 Feb 2017 11:26:00 GMT"
VK:Binnenland,http://www.volkskrant.nl/binnenland/plots-weer-schreeuwend-tekort-aan-personeel-kinderopvang-hoe-kan-dat~a4459034/,Plots weer schreeuwend tekort aan personeel kinderopvang: hoe kan dat?,"Tue, 07 Feb 2017 11:21:00 GMT"
VK:Binnenland,http://www.volkskrant.nl/binnenland/sarkozy-moet-voor-rechter-verschijnen-wegens-gesjoemel-met-verkiezingsgeld~a4459068/,Sarkozy moet voor rechter verschijnen wegens gesjoemel met verkiezingsgeld,"Tue, 07 Feb 2017 10:24:00 GMT"
VK:Binnenland,http://www.volkskrant.nl/economie/niet-sierteelt-of-aardgas-maar-machines-zijn-belangrijkste-nederlandse-exportproduct~a4459013/,Niet sierteelt of aardgas maar machines zijn belangrijkste Nederlandse exportproduct,"Tue, 07 Feb 2017 07:47:00 GMT"
VK:Binnenland,http://www.volkskrant.nl/binnenland/veilig-alternatief-voor-rubberkorrels-in-kunstgras-was-in-2015-al-voorhanden~a4458828/,Veilig alternatief voor rubberkorrels in kunstgras was in 2015 al voorhanden,"Tue, 07 Feb 2017 05:00:00 GMT"
VK:Binnenland,http://www.volkskrant.nl/binnenland/weerbericht-rond-het-vriespunt~a4458698/,Weerbericht: rond het vriespunt,"Tue, 07 Feb 2017 05:00:00 GMT"
VK:Binnenland,http://www.volkskrant.nl/binnenland/pauline-krikke-eerste-vrouwelijke-burgemeester-van-den-haag~a4458743/,Pauline Krikke eerste vrouwelijke burgemeester van Den Haag,"Tue, 07 Feb 2017 04:00:00 GMT"
VK:Binnenland,http://www.volkskrant.nl/opinie/berouw-over-de-moord-op-fortuyn-kan-niet-worden-afgedwongen~a4458753/,Berouw over de moord op Fortuyn kan niet worden afgedwongen,"Tue, 07 Feb 2017 01:00:00 GMT"
VK:Binnenland,http://www.volkskrant.nl/theater/kinderen-zijn-voor-even-de-baas-bij-theater-frascati~a4458730/,Kinderen zijn (voor even) de baas bij Theater Frascati,"Tue, 07 Feb 2017 01:00:00 GMT"
VK:Binnenland,http://www.volkskrant.nl/boeken/jan-wolkers-was-meester-in-de-kunst-van-zelfreflectie~a4458720/,Jan Wolkers was meester in de kunst van zelfreflectie,"Tue, 07 Feb 2017 01:00:00 GMT"
VK:Boeken,http://www.volkskrant.nl/boeken/hoe-dichter-baban-kirkuki-naar-nederland-vluchtte-en-hier-de-pen-weer-oppakte~a4459221/,Hoe dichter Baban Kirkuki naar Nederland vluchtte en hier de pen weer oppakte,"Wed, 08 Feb 2017 01:00:00 GMT"
VK:Boeken,http://www.volkskrant.nl/boeken/jan-wolkers-was-meester-in-de-kunst-van-zelfreflectie~a4458720/,Jan Wolkers was meester in de kunst van zelfreflectie,"Tue, 07 Feb 2017 01:00:00 GMT"
VK:Boeken,http://www.volkskrant.nl/boeken/sander-kok-laat-deel-van-zijn-potentieel-liggen~a4457548/,Sander Kok laat deel van zijn potentieel liggen,"Sat, 04 Feb 2017 01:00:00 GMT"
VK:Boeken,http://www.volkskrant.nl/boeken/heijne-canin-en-meijsing~a4457575/,"Heijne, Canin en Meijsing","Sat, 04 Feb 2017 01:00:00 GMT"
VK:Boeken,http://www.volkskrant.nl/boeken/-de-amerikaanse-droom-is-een-work-in-progress~a4457652/,'De Amerikaanse Droom is een work in progress',"Sat, 04 Feb 2017 01:00:00 GMT"
VK:Boeken,http://www.volkskrant.nl/recensies/hepburns-verhaal-had-lezenswaardiger-boeken-verdiend~a4457562/,Hepburns verhaal had lezenswaardiger boeken verdiend,"Sat, 04 Feb 2017 01:00:00 GMT"
VK:Boeken,http://www.volkskrant.nl/boeken/bij-hofman-geen-ritme-geen-gedachte-geen-muziek~a4457482/,"Bij Hofman geen ritme, geen gedachte, geen muziek","Sat, 04 Feb 2017 01:00:00 GMT"
VK:Boeken,http://www.volkskrant.nl/recensies/poezie-gedragen-door-een-aanstekelijke-energie~a4457579/,Poëzie gedragen door een aanstekelijke energie,"Sat, 04 Feb 2017 01:00:00 GMT"
VK:Boeken,http://www.volkskrant.nl/boeken/nieuwe-roman-ontdekt-in-literair-nalatenschap-lenz~a4457583/,Nieuwe roman ontdekt in literair nalatenschap Lenz,"Sat, 04 Feb 2017 01:00:00 GMT"
VK:Boeken,http://www.volkskrant.nl/boeken/in-the-underground-railroad-wordt-de-spoorweg-wel-letterlijk-opgevat~a4457569/,In the Underground Railroad wordt de spoorweg wel letterlijk opgevat,"Sat, 04 Feb 2017 01:00:00 GMT"
