channel,url,title,date
VK:Media,http://www.volkskrant.nl/magazine/de-componist-van-de-vara-bbc-en-het-simplistisch-verbond~a4459196/,"De componist van de VARA, BBC en het Simplistisch Verbond","Wed, 08 Feb 2017 01:00:00 GMT"
VK:Media,http://www.volkskrant.nl/televisie/de-volkskrant-tv-selectie-voor-woensdag-8-februari~a4459160/,De Volkskrant tv-selectie voor woensdag 8 februari,"Wed, 08 Feb 2017 01:00:00 GMT"
VK:Media,http://www.volkskrant.nl/politiek/denk-daagt-nrc-voor-de-rechter-vanwege-publicatie-uit-2016~a4459305/,Denk daagt NRC voor de rechter vanwege publicatie uit 2016,"Tue, 07 Feb 2017 21:27:00 GMT"
VK:Media,http://www.volkskrant.nl/televisie/ryanne-van-dorst-elle-bandita-wil-taboe-doorbreken-ik-ben-geboren-als-hermafrodiet~a4459072/,Ryanne van Dorst (Elle Bandita) wil taboe doorbreken: ik ben geboren als hermafrodiet,"Tue, 07 Feb 2017 21:14:00 GMT"
VK:Media,http://www.volkskrant.nl/economie/tijdschriften-sanoma-gaan-weer-beter~a4459297/,Tijdschriften Sanoma gaan weer beter,"Tue, 07 Feb 2017 21:14:00 GMT"
VK:Media,http://www.volkskrant.nl/media/het-nieuws-van-vandaag-en-de-krant-van-morgen~a4459237/,Het nieuws van vandaag en de krant van morgen,"Tue, 07 Feb 2017 19:30:00 GMT"
VK:Media,http://www.volkskrant.nl/buitenland/franse-presidentskandidaat-ontkent-vermeende-homoseksualiteit~a4459241/,Franse presidentskandidaat ontkent vermeende homoseksualiteit,"Tue, 07 Feb 2017 18:59:00 GMT"
VK:Media,http://www.volkskrant.nl/media/hoe-patty-brard-de-hulprubriek-waardig-in-ere-houdt~a4459178/,Hoe Patty Brard de hulprubriek waardig in ere houdt,"Tue, 07 Feb 2017 18:30:00 GMT"
VK:Media,http://www.volkskrant.nl/tech/feiten-waren-heilig-voor-statistiekenkoning-hans-rosling-1948-2017~a4459181/,Feiten waren heilig voor statistiekenkoning Hans Rosling (1948 - 2017),"Tue, 07 Feb 2017 16:45:00 GMT"
VK:Media,http://www.volkskrant.nl/buitenland/trumps-aanval-op-de-media-gaat-onverminderd-door-media-slaan-wereldwijd-terug~a4459134/,Trumps aanval op de media gaat onverminderd door; media slaan wereldwijd terug,"Tue, 07 Feb 2017 15:36:00 GMT"
VK:Media,http://www.volkskrant.nl/media/nederlandse-regisseur-matthijs-van-heijningen-jr-maakt-beste-super-bowl-spot~a4459086/,Nederlandse regisseur Matthijs Van Heijningen jr. maakt beste Super Bowl-spot,"Tue, 07 Feb 2017 11:11:00 GMT"
VK:Media,http://www.volkskrant.nl/media/amazonegebied-straks-met-drones-en-smartphones-beschermd-tegen-ontbossing~a4458762/,Amazonegebied straks met drones en smartphones beschermd tegen ontbossing,"Tue, 07 Feb 2017 04:00:00 GMT"
VK:Media,http://www.volkskrant.nl/televisie/homo-als-hoofdpersonage-komt-er-bij-nederlandse-zenderbazen-nog-niet-in~a4458816/,Homo als hoofdpersonage komt er bij Nederlandse zenderbazen nog niet in,"Tue, 07 Feb 2017 01:00:00 GMT"
VK:Media,http://www.volkskrant.nl/televisie/de-volkskrant-tv-selectie-voor-dinsdag-7-februari~a4458740/,De Volkskrant tv-selectie voor dinsdag 7 februari,"Tue, 07 Feb 2017 01:00:00 GMT"
VK:Media,http://www.volkskrant.nl/film/frank-ketelaar-is-een-scenarist-naar-het-leven~a4458791/,Frank Ketelaar is een scenarist naar het leven,"Tue, 07 Feb 2017 01:00:00 GMT"
VK:Media,http://www.volkskrant.nl/opinie/fijn-appen-met-je-petekind-het-kost-enige-moeite~a4458724/,"Fijn appen met je petekind, het kost enige moeite","Tue, 07 Feb 2017 01:00:00 GMT"
VK:Media,http://www.volkskrant.nl/media/het-nieuws-van-vandaag-en-de-krant-van-morgen~a4458768/,Het nieuws van vandaag en de krant van morgen,"Mon, 06 Feb 2017 19:30:00 GMT"
VK:Media,http://www.volkskrant.nl/binnenland/nederlandse-jongeren-delen-nauwelijks-seksueel-getinte-foto-s-via-sociale-media~a4458694/,Nederlandse jongeren delen nauwelijks seksueel getinte foto's via sociale media,"Mon, 06 Feb 2017 15:55:00 GMT"
VK:Media,http://www.volkskrant.nl/media/zijn-datings-apps-een-laatste-toevlucht-voor-de-wanhopige-single~a4452759/,Zijn datings-apps een laatste toevlucht voor de wanhopige single?,"Mon, 06 Feb 2017 08:30:00 GMT"
VK:Media,http://www.volkskrant.nl/economie/markt-smartphones-gaat-op-z-n-kop~a4458358/,Markt smartphones gaat op z'n kop,"Mon, 06 Feb 2017 01:00:00 GMT"
VK:Media,http://www.volkskrant.nl/televisie/de-volkskrant-tv-selectie-voor-maandag-6-februari~a4458270/,De Volkskrant tv-selectie voor maandag 6 februari,"Mon, 06 Feb 2017 01:00:00 GMT"
VK:Media,http://www.volkskrant.nl/economie/de-persgroep-schrapt-banen-bij-huis-aan-huisbladen~a4458343/,De Persgroep schrapt banen bij huis-aan-huisbladen,"Sun, 05 Feb 2017 21:00:00 GMT"
VK:Media,http://www.volkskrant.nl/media/het-nieuws-van-vandaag-en-de-krant-van-morgen~a4458326/,Het nieuws van vandaag en de krant van morgen,"Sun, 05 Feb 2017 19:30:00 GMT"
VK:Media,http://www.volkskrant.nl/televisie/verdient-girls-onuitstaanbare-hannah-een-happy-end~a4458262/,Verdient Girls' onuitstaanbare Hannah een happy end?,"Sun, 05 Feb 2017 18:30:00 GMT"
VK:Media,http://www.volkskrant.nl/media/savile-revised-achteraf-is-het-altijd-makkelijk-praten~a4458285/,Savile Revised: achteraf is het altijd makkelijk praten,"Sun, 05 Feb 2017 17:15:00 GMT"
VK:Media,http://www.volkskrant.nl/media/trump-als-beul-op-cover-der-spiegel-linkse-gutmenschen-laten-ware-aard-zien~a4458191/,Trump als beul op cover Der Spiegel: 'Linkse Gutmenschen laten ware aard zien',"Sun, 05 Feb 2017 06:00:00 GMT"
VK:Media,http://www.volkskrant.nl/televisie/de-volkskrant-tv-selectie-voor-5-februari~a4457642/,De Volkskrant tv-selectie voor 5 februari,"Sun, 05 Feb 2017 01:00:00 GMT"
VK:Media,http://www.volkskrant.nl/media/volkskrant-fotograaf-wint-zilveren-camera-met-indringende-serie-over-kinderarbeid~a4457712/,Volkskrant-fotograaf wint Zilveren Camera met 'indringende' serie over kinderarbeid,"Sat, 04 Feb 2017 21:05:00 GMT"
VK:Media,http://www.volkskrant.nl/opinie/bert-wagendorp-de-behoefte-aan-satire-is-groter-dan-ooit-let-s-go~a4457840/,"Bert Wagendorp: 'De behoefte aan satire is groter dan ooit, let's go!'","Sat, 04 Feb 2017 09:30:00 GMT"
VK:Media,http://www.volkskrant.nl/media/russen-faalden-bij-hackpogingen-ambtenaren-op-nederlandse-ministeries~a4457869/,Russen faalden bij hackpogingen ambtenaren op Nederlandse ministeries,"Sat, 04 Feb 2017 05:00:00 GMT"
VK:Media,http://www.volkskrant.nl/media/-ik-vond-het-gewoon-handig~a4457485/,'Ik vond het gewoon handig',"Sat, 04 Feb 2017 01:00:00 GMT"
VK:Media,http://www.volkskrant.nl/film/journalistiek-in-tijden-van-trump-en-youtube-en-volkskrantdag-in-rotterdam~a4457806/,"Journalistiek in tijden van Trump en YouTube, en Volkskrantdag in Rotterdam","Sat, 04 Feb 2017 01:00:00 GMT"
VK:Media,http://www.volkskrant.nl/opinie/wederhoor-bij-interview-met-sylvana-simons-ontbrak~a4457733/,Wederhoor bij interview met Sylvana Simons ontbrak,"Sat, 04 Feb 2017 01:00:00 GMT"
VK:Media,http://www.volkskrant.nl/opinie/het-nieuws-is-tegenwoordig-vooral-verwarrend~a4457696/,Het nieuws is tegenwoordig vooral verwarrend,"Sat, 04 Feb 2017 01:00:00 GMT"
VK:Media,http://www.volkskrant.nl/boeken/-ik-wilde-als-eerste-en-enige-op-de-plek-zijn-waar-het-gebeurde~a4457473/,'Ik wilde als eerste en enige op de plek zijn waar het gebeurde',"Sat, 04 Feb 2017 01:00:00 GMT"
VK:Media,http://www.volkskrant.nl/televisie/de-volkskrant-tv-selectie-voor-4-februari~a4457601/,De Volkskrant tv-selectie voor 4 februari,"Sat, 04 Feb 2017 01:00:00 GMT"
VK:Media,http://www.volkskrant.nl/media/is-snapchat-nieuwe-facebook-of-toch-meer-twitter~a4457634/,Is Snapchat nieuwe Facebook of toch meer Twitter?,"Fri, 03 Feb 2017 14:02:00 GMT"
VK:Mode & Mooi,http://www.volkskrant.nl/media/ontwerpers-boos-over-onbetaalde-decorpitch-voor-vpro-s-zomergasten~a4459603/,Ontwerpers boos over onbetaalde decorpitch voor VPRO's Zomergasten,"Wed, 08 Feb 2017 09:49:00 GMT"
VK:Mode & Mooi,http://www.volkskrant.nl/beeldende-kunst/wat-de-italiaanse-maffia-in-de-van-goghs-zag~a4458790/,Wat de Italiaanse maffia in de Van Goghs zag,"Tue, 07 Feb 2017 01:00:00 GMT"
VK:Mode & Mooi,http://www.volkskrant.nl/mode-en-mooi/deze-mode-iconen-vormden-modestipendium-winnaar-ronald-van-der-kemp~a4458704/,Deze mode-iconen vormden Modestipendium-winnaar Ronald van der Kemp,"Mon, 06 Feb 2017 19:00:00 GMT"
VK:Mode & Mooi,http://www.volkskrant.nl/mode-en-mooi/ronald-van-der-kemp-wint-belangrijkste-nederlandse-modeprijs-het-modestipendium~a4458734/,Ronald van der Kemp wint belangrijkste Nederlandse modeprijs: het Modestipendium,"Mon, 06 Feb 2017 19:00:00 GMT"
VK:Mode & Mooi,http://www.volkskrant.nl/mode-en-mooi/nederlands-ontwerpersduo-beschuldigt-ikea-van-namaken-proplamp~a4458357/,Nederlands ontwerpersduo beschuldigt IKEA van namaken 'Proplamp',"Mon, 06 Feb 2017 08:35:00 GMT"
VK:Mode & Mooi,http://www.volkskrant.nl/beeldende-kunst/manneken-pis-heeft-nu-zijn-eigen-museum-in-brussel~a4458266/,Manneken Pis heeft nu zijn eigen museum in Brussel,"Mon, 06 Feb 2017 01:00:00 GMT"
VK:Mode & Mooi,http://www.volkskrant.nl/mode-en-mooi/in-een-roes-nog-lang-niet-klaar-met-ruches~a4456448/,In een roes: nog lang niet klaar met ruches,"Sat, 04 Feb 2017 01:00:00 GMT"
VK:Mode & Mooi,http://www.volkskrant.nl/mode-en-mooi/radiolijf-in-een-spijkerbroek-voor-linedancers~a4456369/,Radiolijf in een spijkerbroek voor linedancers,"Sat, 04 Feb 2017 01:00:00 GMT"
VK:Mode & Mooi,http://www.volkskrant.nl/mode-en-mooi/lekker-terug-naar-de-jaren-vijftig~a4456439/,Lekker terug naar de jaren vijftig,"Sat, 04 Feb 2017 01:00:00 GMT"
VK:Mode & Mooi,http://www.volkskrant.nl/mode-en-mooi/vrolijkmakende-tentoonstelling-rond-alledaagse-rituelen~a4456459/,Vrolijkmakende tentoonstelling rond alledaagse rituelen,"Sat, 04 Feb 2017 01:00:00 GMT"
VK:Mode & Mooi,http://www.volkskrant.nl/mode-en-mooi/ikea-meets-klassiek-design-klik-en-klaar-meubels-van-made~a4456473/,IKEA meets klassiek design: klik-en-klaar-meubels van MADE,"Sat, 04 Feb 2017 01:00:00 GMT"
VK:Mode & Mooi,http://www.volkskrant.nl/mode-en-mooi/praktisch-en-mooi-gebitkunst~a4456469/,Praktisch én mooi: gebitkunst,"Sat, 04 Feb 2017 01:00:00 GMT"
VK:Mode & Mooi,http://www.volkskrant.nl/magazine/-ik-draag-nagellak-omdat-ik-dat-leuk-vind~a4456407/,'Ik draag nagellak omdat ik dat leuk vind',"Sat, 04 Feb 2017 01:00:00 GMT"
VK:Mode & Mooi,http://www.volkskrant.nl/mode-en-mooi/-zitliggen-met-sierlijke-poten-welvende-leuningen~a4456467/,"'Zitliggen' met sierlijke poten, welvende leuningen","Sat, 04 Feb 2017 01:00:00 GMT"
VK:Mode & Mooi,http://www.volkskrant.nl/mode-en-mooi/vertrek-ontwerper-riccardo-tisci-is-forse-aderlating-voor-givenchy~a4457518/,Vertrek ontwerper Riccardo Tisci is forse aderlating voor Givenchy,"Fri, 03 Feb 2017 10:11:00 GMT"
VK:Mode & Mooi,http://www.volkskrant.nl/recensies/toeval-bestaat-niet-in-tentoonstelling-martin-creed~a4456571/,Toeval bestaat niet in tentoonstelling Martin Creed,"Thu, 02 Feb 2017 01:00:00 GMT"
VK:Mode & Mooi,http://www.volkskrant.nl/mode-en-mooi/van-moonwalk-naar-catwalk-oud-astronaut-buzz-aldrin-loopt-modeshow~a4456518/,"Van moonwalk naar catwalk, oud-astronaut Buzz Aldrin loopt modeshow","Wed, 01 Feb 2017 16:41:00 GMT"
VK:Mode & Mooi,http://www.volkskrant.nl/mode-en-mooi/-afrikaanse-mode-is-de-laatste-jaren-geexplodeerd~a4456023/,'Afrikaanse mode is de laatste jaren geëxplodeerd',"Wed, 01 Feb 2017 01:00:00 GMT"
VK:Mode & Mooi,http://www.volkskrant.nl/mode-en-mooi/amal-clooney-was-een-ideale-schildersmuze-geweest~a4456007/,Amal Clooney was een ideale schildersmuze geweest,"Wed, 01 Feb 2017 01:00:00 GMT"
VK:Mode & Mooi,http://www.volkskrant.nl/mode-en-mooi/het-experiment-is-terug-bij-de-amsterdamse-modeweek~a4455552/,Het experiment is terug bij de Amsterdamse Modeweek,"Tue, 31 Jan 2017 01:00:00 GMT"
VK:Mode & Mooi,http://www.volkskrant.nl/mode-en-mooi/prachtige-variaties-op-de-lange-klassieke-winterse-trenchcoat~a4453245/,Prachtige variaties op de lange klassieke winterse trenchcoat,"Sat, 28 Jan 2017 01:00:00 GMT"
VK:Mode & Mooi,http://www.volkskrant.nl/magazine/een-bed-voor-de-geboorte-tot-de-middelbare-school~a4453262/,Een bed voor de geboorte tot de middelbare school,"Sat, 28 Jan 2017 01:00:00 GMT"
VK:Mode & Mooi,http://www.volkskrant.nl/mode-en-mooi/mijn-advies-neem-een-stylist-in-dienst~a4453250/,Mijn advies: neem een stylist in dienst,"Sat, 28 Jan 2017 01:00:00 GMT"
VK:Mode & Mooi,http://www.volkskrant.nl/mode-en-mooi/-je-leeft-maar-een-keer-je-moet-spullen-durven-gebruiken~a4453209/,'Je leeft maar één keer; je moet spullen durven gebruiken',"Sat, 28 Jan 2017 01:00:00 GMT"
VK:Mode & Mooi,http://www.volkskrant.nl/magazine/-tegenwoordig-vind-ik-de-mode-voorspelbaar-saai~a4453247/,"'Tegenwoordig vind ik de mode voorspelbaar, saai'","Sat, 28 Jan 2017 01:00:00 GMT"
VK:Mode & Mooi,http://www.volkskrant.nl/mode-en-mooi/is-bont-mijden-hypocriet-voor-een-vleeseter~a4453194/,Is bont mijden hypocriet voor een vleeseter?,"Sat, 28 Jan 2017 01:00:00 GMT"
VK:Mode & Mooi,http://www.volkskrant.nl/wetenschap/steenmarter-die-cern-lamlegde-opgezet-in-rotterdams-museum~a4453803/,Steenmarter die CERN lamlegde opgezet in Rotterdams museum,"Fri, 27 Jan 2017 11:00:00 GMT"
VK:Mode & Mooi,http://www.volkskrant.nl/mode-en-mooi/stijlbroeders-met-een-doe-het-zelfmentaliteit~a4453955/,Stijlbroeders met een doe-het-zelfmentaliteit,"Fri, 27 Jan 2017 01:00:00 GMT"
VK:Mode & Mooi,http://www.volkskrant.nl/mode-en-mooi/bij-van-herpen-kan-een-jurk-ook-van-rubber-zijn~a4452412/,Bij Van Herpen kan een jurk ook van rubber zijn,"Tue, 24 Jan 2017 01:00:00 GMT"
VK:Mode & Mooi,http://www.volkskrant.nl/mode-en-mooi/grens-tussen-straat-en-catwalk-vervaagt~a4451950/,Grens tussen straat en catwalk vervaagt,"Mon, 23 Jan 2017 01:00:00 GMT"
VK:Mode & Mooi,http://www.volkskrant.nl/mode-en-mooi/-ik-houd-van-spullen-met-een-verleden~a4450025/,'Ik houd van spullen met een verleden',"Sat, 21 Jan 2017 01:00:00 GMT"
VK:Mode & Mooi,http://www.volkskrant.nl/mode-en-mooi/amsterdam-fashion-week-zoals-het-ooit-was-springplank-voor-jong-talent~a4450058/,Amsterdam fashion week zoals het ooit was: springplank voor jong talent,"Sat, 21 Jan 2017 01:00:00 GMT"
VK:Mode & Mooi,http://www.volkskrant.nl/reizen/ik-ga-vliegen-en-ik-neem-mee~a4450026/,Ik ga vliegen en ik neem mee,"Sat, 21 Jan 2017 01:00:00 GMT"
VK:Mode & Mooi,http://www.volkskrant.nl/magazine/-waarom-zou-ik-me-iets-aantrekken-van-wat-anderen-van-mij-vinden~a4451039/,'Waarom zou ik me iets aantrekken van wat anderen van mij vinden?',"Sat, 21 Jan 2017 01:00:00 GMT"
VK:Mode & Mooi,http://www.volkskrant.nl/magazine/-ik-draag-unieke-stukken-regelrecht-van-de-catwalk~a4449946/,'Ik draag unieke stukken regelrecht van de catwalk',"Sat, 21 Jan 2017 01:00:00 GMT"
VK:Mode & Mooi,http://www.volkskrant.nl/mode-en-mooi/wit-overhemd-met-de-suggestie-van-blue-collar~a4450036/,Wit overhemd met de suggestie van blue collar,"Sat, 21 Jan 2017 01:00:00 GMT"
VK:Mode & Mooi,http://www.volkskrant.nl/magazine/mijn-eerste-reflex-was-om-plastic-te-boycotten~a4451191/,Mijn eerste reflex was om plastic te boycotten,"Sat, 21 Jan 2017 01:00:00 GMT"
VK:Mode & Mooi,http://www.volkskrant.nl/magazine/vlekkenvloer~a4450031/,Vlekkenvloer,"Sat, 21 Jan 2017 01:00:00 GMT"
VK:Mode & Mooi,http://www.volkskrant.nl/mode-en-mooi/xl-mouwen~a4450044/,XL-Mouwen,"Sat, 21 Jan 2017 01:00:00 GMT"
VK:Mode & Mooi,http://www.volkskrant.nl/buitenland/dit-was-de-jurk-van-melania~a4451303/,Dít was de jurk van Melania,"Fri, 20 Jan 2017 19:00:00 GMT"
VK:Muziek,http://www.volkskrant.nl/magazine/de-componist-van-de-vara-bbc-en-het-simplistisch-verbond~a4459196/,"De componist van de VARA, BBC en het Simplistisch Verbond","Wed, 08 Feb 2017 01:00:00 GMT"
VK:Muziek,http://www.volkskrant.nl/televisie/ryanne-van-dorst-elle-bandita-wil-taboe-doorbreken-ik-ben-geboren-als-hermafrodiet~a4459072/,Ryanne van Dorst (Elle Bandita) wil taboe doorbreken: ik ben geboren als hermafrodiet,"Tue, 07 Feb 2017 21:14:00 GMT"
VK:Muziek,http://www.volkskrant.nl/magazine/-is-dit-dan-het-aziatische-in-mij~a4458699/,'Is dit dan het Aziatische in mij?',"Tue, 07 Feb 2017 01:00:00 GMT"
VK:Muziek,http://www.volkskrant.nl/muziek/zo-wil-het-residentieorkest-nieuw-jong-publiek-lokken~a4458717/,"Zo wil het Residentieorkest nieuw, jong publiek lokken","Tue, 07 Feb 2017 01:00:00 GMT"
VK:Muziek,http://www.volkskrant.nl/muziek/gedichten-uit-de-geheime-laden-van-johnny-cash~a4458712/,Gedichten uit de geheime laden van Johnny Cash,"Mon, 06 Feb 2017 18:30:00 GMT"
VK:Muziek,http://www.volkskrant.nl/muziek/veteranen-van-heavy-metal-voor-het-laatst-op-het-podium~a4458665/,Veteranen van heavy metal voor het laatst op het podium,"Mon, 06 Feb 2017 15:02:00 GMT"
VK:Muziek,http://www.volkskrant.nl/muziek/wereldpremiere-voor-nieuwe-compositie-van-rijnvos~a4458329/,Wereldpremière voor nieuwe compositie van Rijnvos,"Mon, 06 Feb 2017 06:08:00 GMT"
VK:Muziek,http://www.volkskrant.nl/recensies/jett-rebel-speelt-goed-maar-kan-publiek-niet-verleiden~a4458306/,"Jett Rebel speelt goed, maar kan publiek niet verleiden","Mon, 06 Feb 2017 01:00:00 GMT"
VK:Muziek,http://www.volkskrant.nl/muziek/laat-er-geen-twijfel-over-bestaan-levit-is-een-grote~a4458303/,Laat er geen twijfel over bestaan: Levit is een grote,"Sun, 05 Feb 2017 18:31:00 GMT"
VK:Muziek,http://www.volkskrant.nl/recensies/als-latry-aan-speeltafel-zit-zijn-foutjes-te-verwaarlozen~a4457112/,Als Latry aan speeltafel zit zijn foutjes te verwaarlozen,"Fri, 03 Feb 2017 01:00:00 GMT"
VK:Muziek,http://www.volkskrant.nl/magazine/lezer-ineke-stond-op-de-verkeerde-dag-bij-de-concertzaal~a4457063/,Lezer Ineke stond op de verkeerde dag bij de concertzaal,"Fri, 03 Feb 2017 01:00:00 GMT"
VK:Muziek,http://www.volkskrant.nl/muziek/migos-geeft-hakkelende-raps-nu-wel-juiste-ruimte~a4457120/,Migos geeft hakkelende raps nu wel juiste ruimte,"Fri, 03 Feb 2017 01:00:00 GMT"
VK:Muziek,http://www.volkskrant.nl/muziek/-iedereen-heeft-het-recht-om-kennis-te-maken-met-poezie-en-muziek~a4457170/,'Iedereen heeft het recht om kennis te maken met poëzie en muziek',"Fri, 03 Feb 2017 01:00:00 GMT"
VK:Muziek,http://www.volkskrant.nl/recensies/door-focus-op-techniek-is-de-dynamiek-vergeten~a4457099/,Door focus op techniek is de dynamiek vergeten,"Fri, 03 Feb 2017 01:00:00 GMT"
VK:Muziek,http://www.volkskrant.nl/recensies/little-fictions-staat-garant-voor-mooi-verzorgde-rockmuziek~a4457096/,Little Fictions staat garant voor mooi verzorgde rockmuziek,"Fri, 03 Feb 2017 01:00:00 GMT"
VK:Muziek,http://www.volkskrant.nl/muziek/tracks-van-de-week-spinvis-thundercat-en-bob-dylan~a4457090/,"Tracks van de week: Spinvis, Thundercat en Bob Dylan","Fri, 03 Feb 2017 01:00:00 GMT"
VK:Muziek,http://www.volkskrant.nl/muziek/oneindig-treurig-en-apocalyptisch-maar-hypermuzikaal~a4457121/,"Oneindig treurig en apocalyptisch, maar hypermuzikaal","Fri, 03 Feb 2017 01:00:00 GMT"
VK:Muziek,http://www.volkskrant.nl/muziek/schantz-wisselt-fraaie-ballades-af-met-paranoia~a4457114/,Schantz wisselt fraaie ballades af met paranoia,"Fri, 03 Feb 2017 01:00:00 GMT"
VK:Muziek,http://www.volkskrant.nl/muziek/-laat-kleuters-naar-mozart-luisteren-en-ze-vinden-het-fantastisch~a4457117/,'Laat kleuters naar Mozart luisteren en ze vinden het fantastisch',"Fri, 03 Feb 2017 01:00:00 GMT"
VK:Muziek,http://www.volkskrant.nl/muziek/moet-een-piepend-oor-een-keuze-zijn~a4457177/,Moet een piepend oor een keuze zijn?,"Fri, 03 Feb 2017 01:00:00 GMT"
VK:Muziek,http://www.volkskrant.nl/muziek/mich-maakt-puntig-en-goed-geslepen-gitaarpop~a4457084/,Mich maakt puntig en goed geslepen gitaarpop,"Fri, 03 Feb 2017 01:00:00 GMT"
VK:Muziek,http://www.volkskrant.nl/recensies/iedere-barokliefhebber-moet-phantasia-musica-horen~a4457091/,Iedere barokliefhebber moet Phantasia Musica horen,"Fri, 03 Feb 2017 01:00:00 GMT"
VK:Muziek,http://www.volkskrant.nl/muziek/zangeres-vera-lynn-viert-100ste-verjaardag-met-nieuwe-plaat~a4456984/,Zangeres Vera Lynn viert 100ste verjaardag met nieuwe plaat,"Thu, 02 Feb 2017 11:44:00 GMT"
VK:Muziek,http://www.volkskrant.nl/recensies/sterke-show-green-day-voortijdig-verpest-door-misplaatste-meligheid~a4456465/,Sterke show Green Day voortijdig verpest door misplaatste meligheid,"Wed, 01 Feb 2017 12:35:00 GMT"
VK:Muziek,http://www.volkskrant.nl/muziek/progrock-raakt-met-overlijden-john-wetton-opnieuw-grootheid-kwijt~a4456011/,Progrock raakt met overlijden John Wetton opnieuw grootheid kwijt,"Tue, 31 Jan 2017 16:41:00 GMT"
VK:Muziek,http://www.volkskrant.nl/muziek/italiaanse-rocker-verkoopt-180-duizend-kaarten-voor-grootste-europese-optreden-ooit~a4455981/,Italiaanse rocker verkoopt 180 duizend kaarten voor grootste Europese optreden ooit,"Tue, 31 Jan 2017 15:45:00 GMT"
VK:Muziek,http://www.volkskrant.nl/recensies/door-ruisjes-in-robert-holls-stem-heen-hoorde-je-hoop~a4455620/,Door ruisjes in Robert Holls stem heen hoorde je hoop,"Tue, 31 Jan 2017 01:00:00 GMT"
VK:Muziek,http://www.volkskrant.nl/recensies/scepsis-lastig-te-negeren-in-matige-uitvoering-beethovens-fidelio~a4455171/,Scepsis lastig te negeren in matige uitvoering Beethovens Fidelio,"Mon, 30 Jan 2017 01:00:00 GMT"
VK:Muziek,http://www.volkskrant.nl/muziek/optreden-the-flaming-lips-voelt-als-my-little-pony-lsd-trip~a4455069/,Optreden The Flaming Lips  voelt als My-Little-Pony-lsd-trip,"Sun, 29 Jan 2017 13:06:00 GMT"
VK:Muziek,http://www.volkskrant.nl/recensies/drake-rijgt-hits-aan-elkaar-zonder-spanningsboog~a4455037/,Drake rijgt hits aan elkaar zonder spanningsboog,"Sun, 29 Jan 2017 08:59:00 GMT"
VK:Muziek,http://www.volkskrant.nl/voorpagina/-er-is-zoveel-wel-gelukt~a4453252/,'Er is zoveel wél gelukt',"Sat, 28 Jan 2017 01:00:00 GMT"
VK:Muziek,http://www.volkskrant.nl/tech/complete-symfonie-in-luttele-seconden~a4454355/,Complete symfonie in luttele seconden,"Sat, 28 Jan 2017 01:00:00 GMT"
VK:Muziek,http://www.volkskrant.nl/theater/don-giovanni-in-pocketvorm-is-speels-en-humoristisch~a4454554/,Don Giovanni in pocketvorm is speels en humoristisch,"Sat, 28 Jan 2017 01:00:00 GMT"
VK:Muziek,http://www.volkskrant.nl/recensies/japandroids-kan-grootste-festivalweiden-makkelijk-aan~a4453875/,Japandroids kan grootste festivalweiden makkelijk aan,"Fri, 27 Jan 2017 01:00:00 GMT"
VK:Muziek,http://www.volkskrant.nl/muziek/ty-segall-doet-weinig-concessies-aan-garagerock~a4453878/,Ty Segall doet weinig concessies aan garagerock,"Fri, 27 Jan 2017 01:00:00 GMT"
VK:Muziek,http://www.volkskrant.nl/muziek/audi-treft-meesterlijke-balans-tussen-hoorbare-en-zichtbare~a4453929/,Audi treft meesterlijke balans tussen hoorbare en zichtbare,"Fri, 27 Jan 2017 01:00:00 GMT"
VK:Muziek,http://www.volkskrant.nl/recensies/bassdrumbone-geeft-mooist-denkbare-visitekaartje-af~a4453883/,BassDrumBone geeft mooist denkbare visitekaartje af,"Fri, 27 Jan 2017 01:00:00 GMT"
VK:Muziek,http://www.volkskrant.nl/recensies/onweerstaanbaar-en-haast-psychedelisch-dansplaatje~a4453880/,Onweerstaanbaar en haast psychedelisch dansplaatje,"Fri, 27 Jan 2017 01:00:00 GMT"
VK:Muziek,http://www.volkskrant.nl/muziek/kabbelende-liedjes-met-een-fonkelende-stem~a4453879/,Kabbelende liedjes met een fonkelende stem,"Fri, 27 Jan 2017 01:00:00 GMT"
VK:Muziek,http://www.volkskrant.nl/muziek/melnikov-weet-hoe-hij-piano-kan-laten-blaffen-en-bijten~a4453903/,Melnikov weet hoe hij piano kan laten blaffen en bijten,"Fri, 27 Jan 2017 01:00:00 GMT"
VK:Voorpagina,http://www.volkskrant.nl/opinie/opinieblog-ayaan-hirsi-ali-ik-sta-achter-trumps-benadering-van-de-radicale-islam~a4459022/,Opinieblog - Ayaan Hirsi Ali: 'Ik sta achter Trumps benadering van de radicale islam',"Wed, 08 Feb 2017 10:13:00 GMT"
VK:Voorpagina,http://www.volkskrant.nl/sport/opnieuw-afzegging-abn-amro-toernooi-nu-bidden-dat-nadal-niet-uitglijdt-in-badkamer~a4459601/,Opnieuw afzegging ABN Amro-toernooi: 'Nu bidden dat Nadal niet uitglijdt in badkamer',"Wed, 08 Feb 2017 10:03:00 GMT"
VK:Voorpagina,http://www.volkskrant.nl/politiek/wie-kan-met-wie-regeren-bekijk-het-in-deze-coalitiewijzer~a4459611/,Wie kan met wie regeren? Bekijk het in deze coalitiewijzer,"Wed, 08 Feb 2017 10:02:00 GMT"
VK:Voorpagina,http://www.volkskrant.nl/media/ontwerpers-boos-over-onbetaalde-decorpitch-voor-vpro-s-zomergasten~a4459603/,Ontwerpers boos over onbetaalde decorpitch voor VPRO's Zomergasten,"Wed, 08 Feb 2017 09:49:00 GMT"
VK:Voorpagina,http://www.volkskrant.nl/binnenland/verkiezingsblog-aow-leeftijd-breekpunt-voor-50plus-anders-niet-in-kabinet~a4449553/,Verkiezingsblog - AOW-leeftijd breekpunt voor 50Plus: 'Anders niet in kabinet',"Wed, 08 Feb 2017 09:28:00 GMT"
VK:Voorpagina,http://www.volkskrant.nl/sport/schaatsers-dit-weekend-op-olympisch-ijs-zuid-korea-ze-hebben-lekker-gebouwd-hier~a4459593/,Schaatsers dit weekend op olympisch ijs Zuid-Korea: 'Ze hebben lekker gebouwd hier',"Wed, 08 Feb 2017 09:20:00 GMT"
VK:Voorpagina,http://www.volkskrant.nl/politiek/betaalt-tweede-werkende-ouder-65-procent-aan-belasting~a4458731/,Betaalt tweede werkende ouder 65 procent aan belasting?,"Wed, 08 Feb 2017 09:14:00 GMT"
VK:Voorpagina,http://www.volkskrant.nl/buitenland/-miljardenfacelift-voor-amerika-s-gevaarlijkste-bommenwerper-in-wedloop-met-russen~a4459348/,Miljardenfacelift voor Amerika's gevaarlijkste bommenwerper in wedloop met Russen,"Wed, 08 Feb 2017 08:13:00 GMT"
VK:Voorpagina,http://www.volkskrant.nl/buitenland/de-herinnering-aan-poetincriticus-nemtsov-levend-houden-is-niet-zonder-gevaar~a4459550/,De herinnering aan Poetincriticus Nemtsov levend houden is niet zonder gevaar,"Wed, 08 Feb 2017 07:44:00 GMT"
VK:Voorpagina,http://www.volkskrant.nl/buitenland/in-hoger-beroep-nog-geen-beslissing-over-inreisverbod-vs~a4459522/,In hoger beroep nog geen beslissing over inreisverbod VS,"Wed, 08 Feb 2017 06:07:00 GMT"
VK:Voorpagina,http://www.volkskrant.nl/binnenland/wat-nou-tulpen-en-kaas-deze-machines-leveren-holland-veel-meer-op~a4459338/,Wat nou tulpen en kaas: deze machines leveren Holland veel meer op,"Wed, 08 Feb 2017 05:00:00 GMT"
VK:Voorpagina,http://www.volkskrant.nl/politiek/wie-houdt-er-toezicht-op-het-tappen-van-de-overheid~a4459246/,Wie houdt er toezicht op het tappen van de overheid?,"Wed, 08 Feb 2017 05:00:00 GMT"
