channel,url,title,date
VK:Politiek,http://www.volkskrant.nl/politiek/informatie-is-overal-maar-wat-is-betrouwbaar~a4458761/,"Informatie is overal, maar wat is betrouwbaar?","Tue, 07 Feb 2017 01:00:00 GMT"
VK:Politiek,http://www.volkskrant.nl/politiek/zo-steekt-de-stemwijzer-in-elkaar~a4458794/,Zo steekt de Stemwijzer in elkaar,"Tue, 07 Feb 2017 01:00:00 GMT"
VK:Politiek,http://www.volkskrant.nl/politiek/nieuw-in-wilders-repertoire-de-nepfoto~a4458799/,Nieuw in Wilders' repertoire: de nepfoto,"Mon, 06 Feb 2017 20:38:00 GMT"
VK:Politiek,http://www.volkskrant.nl/politiek/factcheck-was-de-pvv-jarenlang-afwezig-tijdens-debatten-over-ggz~a4457708/,Factcheck: was de PVV jarenlang afwezig tijdens debatten over ggz?,"Mon, 06 Feb 2017 17:00:00 GMT"
VK:Politiek,http://www.volkskrant.nl/politiek/het-binnenhof-6-februari~a4458681/,Het Binnenhof: 6 februari,"Mon, 06 Feb 2017 15:45:00 GMT"
VK:Politiek,http://www.volkskrant.nl/binnenland/pechtold-tweet-wilders-is-venijnige-vorm-van-ophitsing~a4458675/,Pechtold: 'Tweet Wilders is venijnige vorm van ophitsing',"Mon, 06 Feb 2017 13:12:00 GMT"
VK:Politiek,http://www.volkskrant.nl/binnenland/den-haag-fel-om-tweet-wilders-met-bewerkte-foto-pechtold-als-shariah-aanhanger~a4458633/,Den Haag fel om tweet Wilders met bewerkte foto Pechtold als shariah-aanhanger,"Mon, 06 Feb 2017 11:28:00 GMT"
VK:Politiek,http://www.volkskrant.nl/opinie/pvda-zou-de-postbank-van-de-politiek-kunnen-zijn~a4458293/,PvdA zou de Postbank van de politiek kunnen zijn,"Mon, 06 Feb 2017 01:00:00 GMT"
VK:Politiek,http://www.volkskrant.nl/opinie/een-paar-observaties-over-de-nationale-bilderbergconferentie~a4458311/,Een paar observaties over de nationale Bilderbergconferentie,"Mon, 06 Feb 2017 01:00:00 GMT"
VK:Politiek,http://www.volkskrant.nl/binnenland/-oprechtheid-is-in-de-tweede-kamer-geen-handige-kwaliteit~a4458327/,'Oprechtheid is in de Tweede Kamer geen handige kwaliteit',"Mon, 06 Feb 2017 01:00:00 GMT"
VK:Politiek,http://www.volkskrant.nl/binnenland/spoedoverleg-over-handmatig-tellen-van-de-stemmen~a4458315/,Spoedoverleg over handmatig tellen van de stemmen,"Sun, 05 Feb 2017 17:35:00 GMT"
VK:Politiek,http://www.volkskrant.nl/politiek/dubieuze-grafiekjes-van-sp-en-groenlinks~a4458238/,Dubieuze grafiekjes van SP en GroenLinks,"Sun, 05 Feb 2017 13:30:00 GMT"
VK:Politiek,http://www.volkskrant.nl/media/russen-faalden-bij-hackpogingen-ambtenaren-op-nederlandse-ministeries~a4457869/,Russen faalden bij hackpogingen ambtenaren op Nederlandse ministeries,"Sat, 04 Feb 2017 05:00:00 GMT"
VK:Politiek,http://www.volkskrant.nl/binnenland/de-ultieme-strijd-tegen-de-oprukkende-a2~a4457846/,De ultieme strijd tegen de oprukkende A2,"Sat, 04 Feb 2017 01:00:00 GMT"
VK:Politiek,http://www.volkskrant.nl/opinie/na-twee-crises-is-het-morele-gezag-van-de-eu-nihil~a4457790/,Na twee crises is het morele gezag van de EU nihil,"Sat, 04 Feb 2017 01:00:00 GMT"
VK:Politiek,http://www.volkskrant.nl/opinie/extreem-rechts-is-niet-tegen-terroristen-maar-tegen-alles-wat-niet-arisch-is~a4457703/,Extreem-rechts is niet tegen terroristen maar tegen alles wat niet Arisch is,"Sat, 04 Feb 2017 01:00:00 GMT"
VK:Politiek,http://www.volkskrant.nl/opinie/wederhoor-bij-interview-met-sylvana-simons-ontbrak~a4457733/,Wederhoor bij interview met Sylvana Simons ontbrak,"Sat, 04 Feb 2017 01:00:00 GMT"
VK:Politiek,http://www.volkskrant.nl/politiek/bij-de-pvda-ontbreekt-het-smartelijk-aan-een-eigen-gezicht~a4457754/,Bij de PvdA ontbreekt het smartelijk aan een eigen gezicht,"Sat, 04 Feb 2017 01:00:00 GMT"
VK:Politiek,http://www.volkskrant.nl/politiek/ploumen-abortusfonds-heeft-steun-van-dertien-landen~a4457821/,Ploumen: abortusfonds heeft steun van dertien landen,"Fri, 03 Feb 2017 20:24:00 GMT"
VK:Recensies,http://www.volkskrant.nl/theater/geslaagde-jeugdtheatervoorstelling-over-oorlog~a4459212/,Geslaagde jeugdtheatervoorstelling over oorlog,"Wed, 08 Feb 2017 01:00:00 GMT"
VK:Recensies,http://www.volkskrant.nl/recensies/santa-clarita-diet-gaat-niet-de-duistere-diepten-in~a4459188/,Santa Clarita Diet gaat niet de duistere diepten in,"Wed, 08 Feb 2017 01:00:00 GMT"
VK:Recensies,http://www.volkskrant.nl/theater/van-veen-blijft-ondanks-uitdagende-ontboezemingen-op-afstand~a4459202/,Van Veen blijft ondanks uitdagende ontboezemingen op afstand,"Wed, 08 Feb 2017 01:00:00 GMT"
VK:Recensies,http://www.volkskrant.nl/theater/simon-boccanegra-is-gewoon-te-saai~a4459214/,Simon Boccanegra is gewoon te saai,"Wed, 08 Feb 2017 01:00:00 GMT"
VK:Recensies,http://www.volkskrant.nl/recensies/burgerlijke-schemering-neemt-het-op-voor-diversiteit-en-verbeelding~a4459187/,Burgerlijke schemering neemt het op voor diversiteit en verbeelding,"Wed, 08 Feb 2017 01:00:00 GMT"
VK:Recensies,http://www.volkskrant.nl/beeldende-kunst/meesterwerken-hangen-zij-aan-zij-met-hun-voorstudies~a4458288/,Meesterwerken hangen zij aan zij met hun voorstudies,"Mon, 06 Feb 2017 01:00:00 GMT"
VK:Recensies,http://www.volkskrant.nl/recensies/jett-rebel-speelt-goed-maar-kan-publiek-niet-verleiden~a4458306/,"Jett Rebel speelt goed, maar kan publiek niet verleiden","Mon, 06 Feb 2017 01:00:00 GMT"
VK:Recensies,http://www.volkskrant.nl/theater/fraai-komediespel-in-armzalig-toneelstuk~a4458321/,Fraai komediespel in armzalig toneelstuk,"Mon, 06 Feb 2017 01:00:00 GMT"
VK:Recensies,http://www.volkskrant.nl/theater/cadance-festival-laat-twee-nieuwelingen-excelleren~a4458322/,CaDance Festival laat twee nieuwelingen excelleren,"Sun, 05 Feb 2017 18:42:00 GMT"
VK:Recensies,http://www.volkskrant.nl/muziek/laat-er-geen-twijfel-over-bestaan-levit-is-een-grote~a4458303/,Laat er geen twijfel over bestaan: Levit is een grote,"Sun, 05 Feb 2017 18:31:00 GMT"
VK:Recensies,http://www.volkskrant.nl/boeken/sander-kok-laat-deel-van-zijn-potentieel-liggen~a4457548/,Sander Kok laat deel van zijn potentieel liggen,"Sat, 04 Feb 2017 01:00:00 GMT"
VK:Recensies,http://www.volkskrant.nl/recensies/hepburns-verhaal-had-lezenswaardiger-boeken-verdiend~a4457562/,Hepburns verhaal had lezenswaardiger boeken verdiend,"Sat, 04 Feb 2017 01:00:00 GMT"
VK:Recensies,http://www.volkskrant.nl/recensies/poezie-gedragen-door-een-aanstekelijke-energie~a4457579/,Poëzie gedragen door een aanstekelijke energie,"Sat, 04 Feb 2017 01:00:00 GMT"
VK:Recensies,http://www.volkskrant.nl/boeken/nieuwe-roman-ontdekt-in-literair-nalatenschap-lenz~a4457583/,Nieuwe roman ontdekt in literair nalatenschap Lenz,"Sat, 04 Feb 2017 01:00:00 GMT"
VK:Recensies,http://www.volkskrant.nl/theater/dansend-op-reis-in-romantisch-en-actueel-tweeluik~a4457853/,Dansend op reis in romantisch en actueel tweeluik,"Sat, 04 Feb 2017 01:00:00 GMT"
VK:Recensies,http://www.volkskrant.nl/recensies/michel-maas-maakt-wat-moeilijk-voor-te-stellen-is-invoelbaar~a4457474/,Michel Maas maakt wat moeilijk voor te stellen is invoelbaar,"Sat, 04 Feb 2017 01:00:00 GMT"
VK:Recensies,http://www.volkskrant.nl/recensies/-lewis-heeft-opnieuw-een-weergaloos-boek-geschreven~a4457581/,'Lewis heeft opnieuw een weergaloos boek geschreven',"Sat, 04 Feb 2017 01:00:00 GMT"
VK:Recensies,http://www.volkskrant.nl/boeken/geen-spoor-van-taalmagier-murakami-in-absolutely-on-music~a4457464/,Geen spoor van taalmagiër Murakami in Absolutely on Music,"Sat, 04 Feb 2017 01:00:00 GMT"
VK:Recensies,http://www.volkskrant.nl/boeken/lijkententoonstelling-is-gevuld-met-beste-oorlogsverhalen~a4457501/,Lijkententoonstelling is gevuld met beste oorlogsverhalen,"Sat, 04 Feb 2017 01:00:00 GMT"
VK:Recensies,http://www.volkskrant.nl/recensies/arme-rijk-is-een-sprookje-vol-woordspelingen~a4457531/,Arme Rijk is een sprookje vol woordspelingen,"Sat, 04 Feb 2017 01:00:00 GMT"
VK:Recensies,http://www.volkskrant.nl/theater/buitenspel-is-te-mager-om-voor-naar-het-theater-te-gaan~a4457125/,Buitenspel is te mager om voor naar het theater te gaan,"Fri, 03 Feb 2017 01:00:00 GMT"
VK:Recensies,http://www.volkskrant.nl/recensies/als-latry-aan-speeltafel-zit-zijn-foutjes-te-verwaarlozen~a4457112/,Als Latry aan speeltafel zit zijn foutjes te verwaarlozen,"Fri, 03 Feb 2017 01:00:00 GMT"
VK:Recensies,http://www.volkskrant.nl/theater/door-weglaten-van-tierelantijnen-valt-haar-talent-des-te-meer-op~a4457133/,Door weglaten van tierelantijnen valt haar talent des te meer op,"Fri, 03 Feb 2017 01:00:00 GMT"
VK:Recensies,http://www.volkskrant.nl/recensies/vlekkeloosheid-die-mechanisch-aandoet~a4457130/,Vlekkeloosheid die mechanisch aandoet,"Fri, 03 Feb 2017 01:00:00 GMT"
VK:Recensies,http://www.volkskrant.nl/muziek/migos-geeft-hakkelende-raps-nu-wel-juiste-ruimte~a4457120/,Migos geeft hakkelende raps nu wel juiste ruimte,"Fri, 03 Feb 2017 01:00:00 GMT"
VK:Recensies,http://www.volkskrant.nl/recensies/little-fictions-staat-garant-voor-mooi-verzorgde-rockmuziek~a4457096/,Little Fictions staat garant voor mooi verzorgde rockmuziek,"Fri, 03 Feb 2017 01:00:00 GMT"
VK:Recensies,http://www.volkskrant.nl/recensies/door-focus-op-techniek-is-de-dynamiek-vergeten~a4457099/,Door focus op techniek is de dynamiek vergeten,"Fri, 03 Feb 2017 01:00:00 GMT"
VK:Recensies,http://www.volkskrant.nl/muziek/schantz-wisselt-fraaie-ballades-af-met-paranoia~a4457114/,Schantz wisselt fraaie ballades af met paranoia,"Fri, 03 Feb 2017 01:00:00 GMT"
VK:Recensies,http://www.volkskrant.nl/muziek/oneindig-treurig-en-apocalyptisch-maar-hypermuzikaal~a4457121/,"Oneindig treurig en apocalyptisch, maar hypermuzikaal","Fri, 03 Feb 2017 01:00:00 GMT"
VK:Recensies,http://www.volkskrant.nl/recensies/iedere-barokliefhebber-moet-phantasia-musica-horen~a4457091/,Iedere barokliefhebber moet Phantasia Musica horen,"Fri, 03 Feb 2017 01:00:00 GMT"
VK:Recensies,http://www.volkskrant.nl/muziek/mich-maakt-puntig-en-goed-geslepen-gitaarpop~a4457084/,Mich maakt puntig en goed geslepen gitaarpop,"Fri, 03 Feb 2017 01:00:00 GMT"
VK:Recensies,http://www.volkskrant.nl/recensies/ed-van-der-elsken-verdient-zijn-ereplek~a4457100/,Ed van der Elsken verdient zijn ereplek,"Thu, 02 Feb 2017 17:47:00 GMT"
VK:Recensies,http://www.volkskrant.nl/recensies/a-monster-calls-is-een-film-om-in-je-hart-te-sluiten~a4457001/,A Monster Calls is een film om in je hart te sluiten,"Thu, 02 Feb 2017 11:09:00 GMT"
VK:Recensies,http://www.volkskrant.nl/recensies/de-erfenis-laat-zien-hoe-verlammend-depressie-kan-zijn~a4456555/,De erfenis laat zien hoe verlammend depressie kan zijn,"Thu, 02 Feb 2017 01:00:00 GMT"
VK:Recensies,http://www.volkskrant.nl/recensies/plot-van-le-ciel-flamand-wordt-steeds-ongeloofwaardiger~a4456588/,Plot van Le Ciel Flamand wordt steeds ongeloofwaardiger,"Thu, 02 Feb 2017 01:00:00 GMT"
VK:Recensies,http://www.volkskrant.nl/film/alles-is-erotiek-in-the-handmaiden~a4456556/,Alles is erotiek in The Handmaiden,"Thu, 02 Feb 2017 01:00:00 GMT"
VK:Recensies,http://www.volkskrant.nl/recensies/in-to-stay-alive-a-method-wordt-houellebecq-geen-moment-zwaar~a4456563/,In To Stay Alive - A Method wordt Houellebecq geen moment zwaar,"Thu, 02 Feb 2017 01:00:00 GMT"
VK:Recensies,http://www.volkskrant.nl/recensies/sleepless-draait-vooral-om-spanning-en-spektakel~a4456561/,Sleepless draait vooral om spanning en spektakel,"Thu, 02 Feb 2017 01:00:00 GMT"
VK:Recensies,http://www.volkskrant.nl/recensies/toeval-bestaat-niet-in-tentoonstelling-martin-creed~a4456571/,Toeval bestaat niet in tentoonstelling Martin Creed,"Thu, 02 Feb 2017 01:00:00 GMT"
VK:Recensies,http://www.volkskrant.nl/recensies/voorzichtige-hoop-en-diep-ingegraven-verdriet~a4456581/,Voorzichtige hoop en diep ingegraven verdriet,"Thu, 02 Feb 2017 01:00:00 GMT"
VK:Reizen,http://www.volkskrant.nl/reizen/eiland-in-de-zoete-zee-van-nicaragua~a4455903/,Eiland in de zoete zee van Nicaragua,"Sat, 04 Feb 2017 01:00:00 GMT"
VK:Reizen,http://www.volkskrant.nl/reizen/reistip-subversief-disneyland-in-tasmanie~a4456380/,Reistip: subversief Disneyland in Tasmanië,"Sat, 04 Feb 2017 01:00:00 GMT"
VK:Reizen,http://www.volkskrant.nl/reizen/een-wonder-dat-het-mooiste-hotel-van-utrecht-er-zo-knap-bij-staat~a4456477/,Een wonder dat het mooiste hotel van Utrecht er zo knap bij staat,"Sat, 04 Feb 2017 01:00:00 GMT"
VK:Reizen,http://www.volkskrant.nl/reizen/oslo-mondain-en-ontzettend-groen~a4455954/,Oslo: mondain en ontzettend groen,"Sat, 04 Feb 2017 01:00:00 GMT"
VK:Reizen,http://www.volkskrant.nl/reizen/overnachting-in-nederlands-hotel-stuk-duurder-104-euro-en-het-wordt-nog-duurder~a4456947/,"Overnachting in Nederlands hotel stuk duurder: 104 euro, en het wordt nog duurder","Thu, 02 Feb 2017 09:31:00 GMT"
VK:Reizen,http://www.volkskrant.nl/reizen/ik-zag-hoe-der-udo-mijn-dochter-omstrengelde~a4456525/,Ik zag hoe 'der Udo' míjn dochter omstrengelde,"Thu, 02 Feb 2017 01:00:00 GMT"
VK:Reizen,http://www.volkskrant.nl/reizen/tinder-voor-orang-oetans-in-de-apenheul~a4456078/,Tinder voor orang-oetans in de Apenheul,"Tue, 31 Jan 2017 19:05:00 GMT"
VK:Reizen,http://www.volkskrant.nl/reizen/het-millennial-hotel-van-cristiano-ronaldo~a4453288/,Het millennial-hotel van Cristiano Ronaldo,"Sat, 28 Jan 2017 01:00:00 GMT"
VK:Reizen,http://www.volkskrant.nl/reizen/dit-muziekfestival-zet-elk-voorjaar-mayrhofen-op-zijn-kop~a4453166/,Dit muziekfestival zet elk voorjaar Mayrhofen op zijn kop,"Sat, 28 Jan 2017 01:00:00 GMT"
VK:Reizen,http://www.volkskrant.nl/buitenland/oxford-eeuwenoude-gebouwen-springlevende-tradities~a4453187/,"Oxford: eeuwenoude gebouwen, springlevende tradities","Sat, 28 Jan 2017 01:00:00 GMT"
VK:Reizen,http://www.volkskrant.nl/reizen/-tussen-de-broeders-neem-je-even-afstand-van-je-leven~a4453264/,'Tussen de broeders neem je even afstand van je leven',"Sat, 28 Jan 2017 01:00:00 GMT"
VK:Reizen,http://www.volkskrant.nl/reizen/ontsnappen-aan-de-drukte-in-bangkok~a4453221/,Ontsnappen aan de drukte in Bangkok,"Thu, 26 Jan 2017 15:00:00 GMT"
VK:Reizen,http://www.volkskrant.nl/reizen/peking-alles-draait-om-toekomst-en-moderniteit~a4449968/,Peking: 'Alles draait om toekomst en moderniteit',"Sat, 21 Jan 2017 01:00:00 GMT"
VK:Reizen,http://www.volkskrant.nl/reizen/ik-ga-vliegen-en-ik-neem-mee~a4450026/,Ik ga vliegen en ik neem mee,"Sat, 21 Jan 2017 01:00:00 GMT"
VK:Reizen,http://www.volkskrant.nl/reizen/vlieg-uitgerust-met-me-mee~a4450010/,Vlieg uitgerust met me mee,"Sat, 21 Jan 2017 01:00:00 GMT"
VK:Reizen,http://www.volkskrant.nl/buitenland/thailands-andere-gezicht-minder-commercieel-minder-druk~a4449994/,"Thailands andere gezicht: minder commercieel, minder druk","Sat, 21 Jan 2017 01:00:00 GMT"
VK:Reizen,http://www.volkskrant.nl/reizen/slapen-in-het-nh-collection-madrid-suecia~a4449960/,Slapen in het NH Collection Madrid Suecia,"Thu, 19 Jan 2017 15:00:00 GMT"
VK:Reizen,http://www.volkskrant.nl/reizen/nostalgische-collectie-ansichtkaarten~a4450030/,Nostalgische collectie ansichtkaarten,"Thu, 19 Jan 2017 15:00:00 GMT"
VK:Reizen,http://www.volkskrant.nl/buitenland/honderd-nederlandse-toeristen-vliegen-pas-zaterdag-terug-uit-gambia~a4450202/,Honderd Nederlandse toeristen vliegen pas zaterdag terug uit Gambia,"Wed, 18 Jan 2017 19:23:00 GMT"
VK:Reizen,http://www.volkskrant.nl/magazine/de-moeder-van-het-noorder-dierenpark~a4449129/,De moeder van het Noorder Dierenpark,"Tue, 17 Jan 2017 01:00:00 GMT"
VK:Reizen,http://www.volkskrant.nl/reizen/hoe-weeshuizen-toeristen-misleiden-om-donaties-binnen-te-harken~a4449133/,Hoe weeshuizen toeristen misleiden om donaties binnen te harken,"Mon, 16 Jan 2017 18:30:00 GMT"
VK:Reizen,http://www.volkskrant.nl/reizen/reistip-urban-jungle-in-de-stad~a4446329/,Reistip: Urban jungle in de stad,"Sat, 14 Jan 2017 01:00:00 GMT"
VK:Reizen,http://www.volkskrant.nl/reizen/hoeveel-paars-kan-een-mens-verdragen~a4446783/,Hoeveel paars kan een mens verdragen?,"Thu, 12 Jan 2017 15:00:00 GMT"
VK:Reizen,http://www.volkskrant.nl/reizen/reuzenpanda-s-wu-wen-en-xing-ya-komen-definitief-naar-rhenen~a4446884/,Reuzenpanda's Wu Wen en Xing Ya komen definitief naar Rhenen,"Wed, 11 Jan 2017 16:31:00 GMT"
VK:Reizen,http://www.volkskrant.nl/reizen/in-rhenen-staat-de-pandacouveuse-alvast-klaar~a4446469/,In Rhenen staat de pandacouveuse alvast klaar,"Tue, 10 Jan 2017 18:30:00 GMT"
VK:Reizen,http://www.volkskrant.nl/economie/vakantie-in-eigen-land-populairder-onveilige-landen-worden-gemeden~a4446421/,Vakantie in eigen land populairder: 'onveilige landen' worden gemeden,"Tue, 10 Jan 2017 18:01:00 GMT"
VK:Reizen,http://www.volkskrant.nl/binnenland/hulporganisaties-stuur-toeristen-niet-meer-langs-weeshuizen-in-arme-landen~a4445381/,Hulporganisaties: stuur toeristen niet meer langs weeshuizen in arme landen,"Sat, 07 Jan 2017 12:18:00 GMT"
VK:Reizen,http://www.volkskrant.nl/voorpagina/dit-moet-je-zien-in-praag~a4443812/,Dit moet je zien in Praag,"Sat, 07 Jan 2017 01:00:00 GMT"
VK:Reizen,http://www.volkskrant.nl/reizen/slapen-in-een-voormalige-chocoladefabriek-hotel-boutet~a4443302/,"Slapen in een voormalige chocoladefabriek, Hotel Boutet","Sat, 07 Jan 2017 01:00:00 GMT"
VK:Reizen,http://www.volkskrant.nl/buitenland/wat-hebben-al-die-westerse-mensen-met-het-boeddhisme~a4443352/,Wat hebben al die westerse mensen met het boeddhisme?,"Sat, 07 Jan 2017 01:00:00 GMT"
VK:Reizen,http://www.volkskrant.nl/reizen/moet-flevolandse-wildernis-wijken-voor-toeristen~a4445040/,Moet Flevolandse wildernis wijken voor toeristen?,"Sat, 07 Jan 2017 01:00:00 GMT"
VK:Reizen,http://www.volkskrant.nl/reizen/reistip-wonderlijke-verhalen-achter-omstreden-kaarten~a4443809/,Reistip: wonderlijke verhalen achter omstreden kaarten,"Sat, 07 Jan 2017 01:00:00 GMT"
VK:Reizen,http://www.volkskrant.nl/buitenland/aardbeienteelt-bedreigt-een-uniek-spaans-moerasgebied~a4444421/,Aardbeienteelt bedreigt een uniek Spaans moerasgebied,"Thu, 05 Jan 2017 18:30:00 GMT"
VK:Reizen,http://www.volkskrant.nl/reizen/nederlander-spot-6-833-vogels-en-is-nu-officieuze-wereldrecordhouder~a4443430/,Nederlander spot 6.833 vogels - en is nu officieuze wereldrecordhouder,"Tue, 03 Jan 2017 18:00:00 GMT"
VK:Reizen,http://www.volkskrant.nl/reizen/duurzaam-op-reis-in-2017~a4440773/,Duurzaam op reis in 2017,"Sat, 31 Dec 2016 01:00:00 GMT"
VK:Reizen,http://www.volkskrant.nl/reizen/onze-beste-reisreportages-van-dit-jaar~a4441957/,Onze beste reisreportages van dit jaar,"Fri, 30 Dec 2016 15:30:00 GMT"
VK:Reizen,http://www.volkskrant.nl/reizen/dit-waren-onze-beste-reistips~a4441937/,Dit waren onze beste reistips,"Fri, 30 Dec 2016 15:02:00 GMT"
VK:Reizen,http://www.volkskrant.nl/media/selfie-met-boardingpass-is-niet-zonder-risico~a4440800/,Selfie met boardingpass is niet zonder risico,"Wed, 28 Dec 2016 12:50:00 GMT"
VK:Reizen,http://www.volkskrant.nl/reizen/reizen-met-de-bus-perfect-als-je-wat-te-verbergen-hebt~a4440742/,Reizen met de bus: perfect als je wat te verbergen hebt,"Wed, 28 Dec 2016 11:02:00 GMT"
VK:Reizen,http://www.volkskrant.nl/reizen/de-leukste-plekken-in-de-algarve~a4433368/,De leukste plekken in de Algarve,"Sat, 17 Dec 2016 01:00:00 GMT"
VK:Sport,http://www.volkskrant.nl/sport/opnieuw-afzegging-abn-amro-toernooi-nu-bidden-dat-nadal-niet-uitglijdt-in-badkamer~a4459601/,Opnieuw afzegging ABN Amro-toernooi: 'Nu bidden dat Nadal niet uitglijdt in badkamer',"Wed, 08 Feb 2017 10:03:00 GMT"
VK:Sport,http://www.volkskrant.nl/sport/schaatsers-dit-weekend-op-olympisch-ijs-zuid-korea-ze-hebben-lekker-gebouwd-hier~a4459593/,Schaatsers dit weekend op olympisch ijs Zuid-Korea: 'Ze hebben lekker gebouwd hier',"Wed, 08 Feb 2017 09:20:00 GMT"
VK:Sport,http://www.volkskrant.nl/sport/onderzoek-naar-omstreden-betalingen-spelen-tokio-2020~a4459540/,Onderzoek naar omstreden betalingen Spelen Tokio 2020,"Wed, 08 Feb 2017 04:31:00 GMT"
VK:Sport,http://www.volkskrant.nl/sport/-laat-mij-maar-bewijzen-dat-ik-nog-steeds-bij-de-top-hoor~a4459330/,'Laat mij maar bewijzen dat ik nog steeds bij de top hoor',"Wed, 08 Feb 2017 01:00:00 GMT"
VK:Sport,http://www.volkskrant.nl/sport/wust-mist-olympische-sfeer-in-gangneung~a4459291/,Wüst mist olympische sfeer in Gangneung,"Wed, 08 Feb 2017 01:00:00 GMT"
VK:Sport,http://www.volkskrant.nl/sport/opkrabbelen-in-de-franse-premier-league-light~a4459281/,Opkrabbelen in de Franse 'Premier League-light',"Wed, 08 Feb 2017 01:00:00 GMT"
VK:Sport,http://www.volkskrant.nl/sport/is-vitesse-nog-op-tijd-om-gelredome-te-kopen~a4459307/,Is Vitesse nog op tijd om Gelredome te kopen?,"Wed, 08 Feb 2017 01:00:00 GMT"
VK:Sport,http://www.volkskrant.nl/sport/geldschieter-roda-jc-was-topper-in-schoonspringen~a4459334/,Geldschieter Roda JC was topper in schoonspringen,"Wed, 08 Feb 2017 01:00:00 GMT"
VK:Sport,http://www.volkskrant.nl/sport/sportblog-wereldkampioen-philipp-lahm-bevestigt-einde-voetballoopbaan~a4450290/,Sportblog -  Wereldkampioen Philipp Lahm bevestigt einde voetballoopbaan,"Tue, 07 Feb 2017 22:40:00 GMT"
VK:Sport,http://www.volkskrant.nl/sport/de-wraak-van-super-bowl-held-brady-op-deflategate~a4459081/,De wraak van Super Bowl-held Brady op Deflategate,"Tue, 07 Feb 2017 11:40:00 GMT"
VK:Sport,http://www.volkskrant.nl/sport/ado-den-haag-hoopt-op-schokeffect-en-ontslaat-trainer-petrovic~a4459058/,ADO Den Haag 'hoopt op schokeffect' en ontslaat trainer Petrovic,"Tue, 07 Feb 2017 10:03:00 GMT"
VK:Sport,http://www.volkskrant.nl/binnenland/veilig-alternatief-voor-rubberkorrels-in-kunstgras-was-in-2015-al-voorhanden~a4458828/,Veilig alternatief voor rubberkorrels in kunstgras was in 2015 al voorhanden,"Tue, 07 Feb 2017 05:00:00 GMT"
VK:Sport,http://www.volkskrant.nl/sport/na-moment-van-wanhoop-krijgt-li-jie-grip-op-dat-duivelse-balletje~a4458775/,Na moment van wanhoop krijgt Li Jie grip op dat duivelse balletje,"Tue, 07 Feb 2017 01:00:00 GMT"
VK:Sport,http://www.volkskrant.nl/sport/nederland-wilde-strengste-kunstgraskorrels-norm~a4458817/,Nederland wilde strengste kunstgraskorrels-norm,"Tue, 07 Feb 2017 01:00:00 GMT"
VK:Sport,http://www.volkskrant.nl/sport/internationale-atletiekfederatie-handhaaft-schorsing-russische-atleten~a4458783/,Internationale atletiekfederatie handhaaft schorsing Russische atleten,"Mon, 06 Feb 2017 20:54:00 GMT"
VK:Sport,http://www.volkskrant.nl/buitenland/bizarre-super-bowl-was-verkiezingen-all-over-again-team-trump-wint~a4458534/,"Bizarre Super Bowl was verkiezingen all over again, team Trump wint","Mon, 06 Feb 2017 06:46:00 GMT"
VK:Sport,http://www.volkskrant.nl/sport/na-moeizame-start-lukt-patriots-opeens-alles-in-ongekende-super-bowl~a4458554/,Na moeizame start lukt Patriots opeens alles in ongekende Super Bowl,"Mon, 06 Feb 2017 04:16:00 GMT"
VK:Sport,http://www.volkskrant.nl/sport/veldhockeyer-mirco-pruyser-pusht-met-passie-in-de-zaal~a4458351/,Veldhockeyer Mirco Pruyser pusht met passie in de zaal,"Mon, 06 Feb 2017 01:07:00 GMT"
VK:Sport,http://www.volkskrant.nl/sport/abnormaal-doen-lijkt-even-de-standaard-in-kerkrade~a4458325/,Abnormaal doen lijkt even de standaard in Kerkrade,"Mon, 06 Feb 2017 01:00:00 GMT"
VK:Sport,http://www.volkskrant.nl/sport/werpmachine-als-trainingsmaatje-voor-honkballers~a4458348/,Werpmachine als trainingsmaatje voor honkballers,"Mon, 06 Feb 2017 01:00:00 GMT"
VK:Sport,http://www.volkskrant.nl/sport/lindsey-vonn-wil-iedereen-verslaan-dus-ook-mannen~a4458355/,Lindsey Vonn wil iedereen verslaan - dus ook mannen,"Mon, 06 Feb 2017 01:00:00 GMT"
VK:Sport,http://www.volkskrant.nl/sport/de-titel-is-mooi-meegenomen-op-nk-indoor-voor-vrouwen~a4458335/,De titel is mooi meegenomen op NK indoor voor vrouwen,"Mon, 06 Feb 2017 01:00:00 GMT"
VK:Sport,http://www.volkskrant.nl/sport/vrouw-versus-man-in-de-sport-wisselend-succes~a4458353/,Vrouw versus man in de sport: wisselend succes,"Mon, 06 Feb 2017 01:00:00 GMT"
VK:Sport,http://www.volkskrant.nl/sport/super-bowl-amerikaans-feestje-heeft-bittere-bijsmaak-gekregen~a4457779/,Super Bowl: Amerikaans feestje heeft bittere bijsmaak gekregen,"Sun, 05 Feb 2017 22:00:00 GMT"
VK:Sport,http://www.volkskrant.nl/sport/afrika-cup-is-altijd-feest-maar-zonder-echt-spektakel~a4458364/,"Afrika Cup is altijd feest, maar zonder écht spektakel","Sun, 05 Feb 2017 21:30:00 GMT"
VK:Sport,http://www.volkskrant.nl/sport/kameroen-verslaat-egypte-in-finale-afrika-cup~a4458362/,Kameroen verslaat Egypte in finale Afrika Cup,"Sun, 05 Feb 2017 21:15:00 GMT"
VK:Sport,http://www.volkskrant.nl/sport/shorttrackster-schulting-boekt-historische-overwinning~a4458341/,Shorttrackster Schulting boekt historische overwinning,"Sun, 05 Feb 2017 20:30:00 GMT"
VK:Sport,http://www.volkskrant.nl/sport/debuut-tim-krul-bij-az-eindigt-in-nederlaag-tegen-psv~a4458305/,Debuut Tim Krul bij AZ eindigt in nederlaag tegen PSV,"Sun, 05 Feb 2017 18:51:00 GMT"
VK:Sport,http://www.volkskrant.nl/sport/feyenoord-wint-in-intense-strijd-met-0-2-van-fc-twente~a4458259/,Feyenoord wint in intense strijd met 0-2 van FC Twente,"Sun, 05 Feb 2017 15:30:00 GMT"
VK:Sport,http://www.volkskrant.nl/sport/roda-verliest-van-ajax-na-tumultueuze-week~a4458254/,Roda verliest van Ajax na tumultueuze week,"Sun, 05 Feb 2017 13:58:00 GMT"
VK:Sport,http://www.volkskrant.nl/sport/van-het-tweede-plan-naar-een-tweede-jeugd-in-belgie~a4457843/,Van het tweede plan naar een tweede jeugd in België,"Sat, 04 Feb 2017 01:07:00 GMT"
VK:Sport,http://www.volkskrant.nl/sport/roda-jc-wil-champions-league-in-met-anelka~a4457861/,Roda JC wil Champions League in met Anelka,"Sat, 04 Feb 2017 01:00:00 GMT"
VK:Sport,http://www.volkskrant.nl/sport/voetbal-is-het-vermakelijkst-als-niemand-normaal-doet~a4457747/,Voetbal is het vermakelijkst als niemand normaal doet,"Sat, 04 Feb 2017 01:00:00 GMT"
VK:Sport,http://www.volkskrant.nl/sport/vrouwenhockeyploeg-verliest-met-beste-keepster-ter-wereld-opnieuw-een-icoon~a4457774/,Vrouwenhockeyploeg verliest met beste keepster ter wereld opnieuw een icoon,"Fri, 03 Feb 2017 18:55:00 GMT"
VK:Sport,http://www.volkskrant.nl/sport/dat-is-wennen-zo-n-nieuw-balletje~a4457178/,"Dat is wennen, zo'n nieuw balletje","Fri, 03 Feb 2017 01:00:00 GMT"
VK:Sport,http://www.volkskrant.nl/sport/grote-drie-van-eredivisie-laat-rest-hielen-zien~a4457174/,Grote Drie van eredivisie laat rest hielen zien,"Fri, 03 Feb 2017 01:00:00 GMT"
VK:Sport,http://www.volkskrant.nl/sport/bekend-voetbalgezicht-als-stemmentrekker~a4457144/,Bekend voetbalgezicht als stemmentrekker,"Fri, 03 Feb 2017 01:00:00 GMT"
